berasa tk lagi kalo sama mereka mystudent myinspiration cute funny instagram	0	0	0	0	0	0	0	0	0	0	1	0	0	0	0	0	0
purple haze kiss sky cannabis weed meme 420 goodvibes monday tweeder cheech	0	0	0	0	0	0	0	0	0	0	0	0	0	0	0	0	0
happy holi wish u holi may become nnniiiccceee one fun onces holi	0	0	0	0	0	1	0	0	0	0	0	0	0	1	0	0	0
life water worldwaterday 2016	0	0	0	1	0	0	0	0	0	0	0	0	0	0	0	0	0
purpose career boss business ceo life lifeforce alive success	0	0	0	1	0	0	0	0	0	0	0	0	0	0	0	0	0
feliscumpleeeeeeparami mis19 love quenotermine	1	0	0	0	0	0	0	0	0	0	0	0	0	0	0	0	0
positivethinking positiveenergy goodvibes	0	0	0	0	0	0	0	0	0	0	0	0	0	0	0	0	0
nyr win loss isles kings 0 3 nsh beautiful night lt 3 purejoy havingfun thingsastheyshouldbe	0	0	0	0	1	0	0	0	0	0	0	0	0	0	0	0	0
thankful date nights thankful positive	0	0	0	0	0	0	0	0	0	0	0	0	0	0	0	0	0
pega kid kids nice beautiful usa barbie marvel	0	0	0	0	1	0	0	0	0	0	0	0	0	0	0	0	0
hillary happy pander israel week hillary clinton gave strong pro israel speech	0	0	0	0	0	1	0	0	0	0	0	0	0	0	0	0	0
thankful date nights thankful positive	0	0	0	0	0	0	0	0	0	0	0	0	0	0	0	0	0
thankful date nights thankful positive	0	0	0	0	0	0	0	0	0	0	0	0	0	0	0	0	0
thankful date nights thankful positive	0	0	0	0	0	0	0	0	0	0	0	0	0	0	0	0	0
analcandy23 na nasty horny wet xxx sexy shy young slut porn kinky nude naughty hot	0	0	0	0	0	0	0	0	0	0	0	0	0	0	0	0	0
happy mean forever sad sto mean forever cause sad story happy ending	0	0	0	0	0	2	0	0	0	0	0	0	0	0	0	0	0
nada como estar feliz satisfecho tranquilo con todo lo que tienes eres blessed	0	0	0	0	0	0	0	0	0	0	0	0	1	0	0	0	0
life comes around whatever makes	0	0	0	1	0	0	0	0	0	0	0	0	0	0	0	0	0
feliz noche andy cute baby babyboy show dancer tonightisthenight hi	0	0	0	0	0	0	0	0	0	0	1	0	0	0	0	0	0
10th anniversary	0	0	0	0	0	0	0	0	0	0	0	0	0	0	0	0	0
pleasure listen another fox debate two grateful cnn fox	0	0	0	0	0	0	0	0	0	0	0	0	0	0	0	0	0
day drink pool friends gay like parque acuatico paraiso alteo	0	1	0	0	0	0	0	0	1	0	0	0	0	0	0	0	0
cozumel blue sky picoftheday cozumel mexico beautiful sun turisteando travel pattyfrey	0	0	0	0	1	0	0	0	0	0	0	0	0	0	0	0	0
3 17 3 18 uno graduation thanks travel uno 8 cake sea	0	0	0	0	0	0	0	0	0	0	0	0	0	0	0	0	0
pegadi kid kids nice beautiful usa barbie marvel	0	0	0	0	1	0	0	0	0	0	0	0	0	0	0	0	0
11 andar deus love amazing go cute good tvd music lol instagram instagood	1	0	0	0	0	0	0	0	0	0	1	0	0	0	0	0	1
always look bright side life inspirationalquotes optimism healthy	0	0	0	1	0	0	0	0	0	0	0	0	0	0	0	0	0
dia likes music fumando paseo flowers yonofui	0	0	0	0	0	0	0	0	0	0	0	0	0	0	0	0	0
pongo como santi	0	0	0	0	0	0	0	0	0	0	0	0	0	0	0	0	0
regrann donnacruzyl youraisemeup musicrecital motherandson blessed	0	0	0	0	0	0	0	0	0	0	0	0	0	0	0	0	0
pin kid kids nice beautiful usa barbie marvel	0	0	0	0	1	0	0	0	0	0	0	0	0	0	0	0	0
remember cannot make anyone happy happy life give priority zunterism	0	0	0	1	0	2	0	0	0	0	0	0	0	0	0	0	0
meigen	0	0	0	0	0	0	0	0	0	0	0	0	0	0	0	0	0
ganito kami kagulo crazy bestfriend best happiness weird selfie selfiebuddys	0	0	0	0	0	0	0	0	0	0	0	0	0	0	0	0	0
holi 2072	0	0	0	0	0	0	0	0	0	0	0	0	0	0	0	0	0
asek jkt ruwet untung sdh kabur dr jkt	0	0	0	0	0	0	0	0	0	0	0	0	0	0	0	0	0
nationalfragranceday fun love fragrant hugs dshperfumes	1	0	0	0	0	0	0	0	0	0	0	0	0	1	0	0	0
happy sweets time line	0	0	0	0	0	1	0	0	0	0	0	0	0	0	0	0	0
tsutaya tsutayadvd	0	0	0	0	0	0	0	0	0	0	0	0	0	0	0	0	0
ela chega e faz xxx dofds projota music batomvermelho boanoite	0	0	0	0	0	0	0	0	0	0	0	0	0	0	0	0	0
beauty nature happiness relaxing	0	0	0	0	0	0	0	0	0	0	0	0	0	0	0	0	0
oa glases instachile instaarauco studying study coqueta	0	0	0	0	0	0	0	0	0	0	0	0	0	0	0	0	0
rainbow rainyday clouds cloudyday positivevibes positivity happiness uplifting smile shine	0	0	1	0	0	0	0	0	0	0	0	0	0	0	0	0	0
toques los cojones likers lfl likeforlike likeme followers cojones espaa selfie fff lov	0	0	0	0	0	0	0	0	0	0	0	0	0	0	0	0	0
available app store lol fun enjoy smile laugh life rofl credits 9gag	0	0	1	1	0	0	0	0	0	0	0	0	0	1	0	0	0
ooooo comfy smile fun instahappy sohappy happier excited comfybed instatags4likes goodmood	0	0	1	0	0	0	0	0	0	0	0	0	0	1	0	0	0
chivos like4like l4l cumplecousin replay losamo las torres eventos la banda	0	0	0	0	0	0	0	0	0	0	0	1	0	0	0	0	0
results im shocked diywraps loseinchs	0	0	0	0	0	0	0	0	0	0	0	0	0	0	0	0	0
lasvages mandalaybay visual golden light march enjoy enjoying vacation	0	0	0	0	0	0	0	0	0	0	0	0	0	0	0	0	0
pcy exo luxion dot seoul chanyeol pcy exoluxion seoul handsome love parkchanonly r	1	0	0	0	0	0	0	0	0	0	0	0	0	0	0	0	0
	0	0	0	0	0	0	0	0	0	1	0	0	0	0	0	0	0
pegad kid kids nice beautiful usa barbie marvel	0	0	0	0	1	0	0	0	0	0	0	0	0	0	0	0	0
thailand trip citytour shopping vacation holiday liburan jalanjalan jalanjalan str	0	0	0	0	0	0	0	0	0	0	0	0	0	0	0	0	0
never forget happy smile always raiseyournana	0	0	1	0	0	1	0	0	0	0	0	0	0	0	0	0	0
let shine goodvibes goofy sunday sunshine ootd redprint istanbul	0	0	0	0	0	0	0	0	0	0	0	0	0	0	0	0	0
chicken gets bath sink blowdry pampering florence barredrock	0	0	0	0	0	0	0	0	0	0	0	0	0	0	0	0	0
noches de gloria feliz lunes festivo inshot girls cute summer blur sun fun	0	0	0	0	0	0	1	0	0	0	1	0	0	1	0	0	0
siluet selfie wedding happy wedding mbak tata dan mas	0	0	0	0	0	1	0	0	0	0	0	0	0	0	0	0	0
0 rescue	0	0	0	0	0	0	0	0	0	0	0	0	0	0	0	0	0
happiness us day family packet internationaldayofhappiness nzjerky beefjerky	0	1	0	0	0	0	0	0	0	0	0	0	0	0	0	0	0
hey friday tgif goodvibes rainbow twerk surprise glitz glam energy	0	0	0	0	0	0	0	0	0	0	0	0	0	0	0	0	0
2shoppingday fun enjoy photo korea karen love friends	1	0	0	0	0	0	0	0	0	0	0	0	0	1	0	0	0
miamimusicweek2016 paradise betterimpossible	0	0	0	0	0	0	0	0	0	0	0	0	0	0	0	0	0
algo day monday motivacion	0	1	0	0	0	0	0	0	0	0	0	0	0	0	0	0	0
tv rp 20 000 gpp kok lumayan bs tukar dollar	0	0	0	0	0	0	0	0	0	0	0	0	0	0	0	0	0
discovered roku done night caribbeanlife islandlife beachfrontbargainhunt fixerupper	0	0	0	0	0	0	0	0	0	0	0	0	0	0	0	0	0
3 day week yes good loveit goodvibes thumbsup lovelife	0	1	0	0	0	0	0	0	0	0	0	0	0	0	0	0	1
lots pats pretty boy cute animal cat kitty pats fluffy missy love	1	0	0	0	0	0	0	0	0	0	1	0	0	0	0	0	0
makes happy smile behappy pink	0	0	1	0	0	1	0	0	0	0	0	0	0	0	0	0	0
beach weekend	0	0	0	0	0	0	0	0	0	0	0	0	0	0	0	0	0
clover	0	0	0	0	0	0	0	0	0	0	0	0	0	0	0	0	0
gamer darksouls2 twitter youtube	0	0	0	0	0	0	0	0	0	0	0	0	0	0	0	0	0
take day1goal family phonecall nike underarmour miami 305 850	0	0	0	0	0	0	0	0	0	0	0	0	0	0	0	0	0
piensadiferente love likes follow wonderful incredible inspiration motivation	1	0	0	0	0	0	0	0	0	0	0	0	0	0	0	0	0
cambio las noches de mendoza por nada carasraras nihgt friends tbt wish	0	0	0	0	0	0	1	0	0	0	0	0	0	0	0	0	0
porque cuando estoy con ella dejo de reir amarla friends love crazy smile	1	0	1	0	0	0	1	0	0	0	0	0	0	0	0	0	0
love find pics pic avec les enfants maroc icecream	1	0	0	0	0	0	0	0	0	0	0	0	0	0	0	0	0
spring time dress time dress spring cute	0	0	0	0	0	0	0	0	0	0	1	0	0	0	0	0	0
arrived home pug home pet pugalier puppy first day cute small dog	0	1	0	0	0	0	0	0	0	0	1	0	0	0	0	0	0
nice day full diy projects knitting done lot else okay	0	1	0	0	0	0	0	0	0	0	0	0	0	0	0	0	0
travel genie itinerary love fun f4f sun beach hope genie busy making reservations	1	0	0	0	0	0	0	0	0	0	0	0	0	1	0	0	0
instagram siyakeram sunshine starplus alotoffun lastdays	0	0	0	0	0	0	0	0	0	0	0	0	0	0	0	0	0
cat kitty c click	0	0	0	0	0	0	0	0	0	0	0	0	0	0	0	0	0
cat kitty hawaii click	0	0	0	0	0	0	0	0	0	0	0	0	0	0	0	0	0
cat kitty frankie click	0	0	0	0	0	0	0	0	0	0	0	0	0	0	0	0	0
cat kitty gaetano de pasquale click	0	0	0	0	0	0	1	0	0	0	0	0	0	0	0	0	0
cat kitty purple rain click	0	0	0	0	0	0	0	0	0	0	0	0	0	0	0	0	0
el mircoles vienen los raffo estoy reeeee	0	0	0	0	0	0	0	0	0	0	0	0	0	0	0	0	0
nyesha honolulu maohinui heivaihonolulu oritahiti competition winner fun awesome hawaii 808 love loveit cos	1	0	0	0	0	0	0	0	0	0	0	0	0	1	0	0	0
interesting read positivepsychology mindset teachers science	0	0	0	0	0	0	0	0	0	0	0	0	0	0	0	0	0
hola hot hotel relax florianopolis brasil face floripa amazing tired	0	0	0	0	0	0	0	0	0	0	0	0	0	0	0	0	0
scalinataditrinitdeimonti piazzadispagna rome landmark summer love sun needvacation needsummer	1	0	0	0	0	0	0	0	0	0	0	0	0	0	0	0	0
tonight moon rise moon moonrise newmexico nature journey life living listen	0	0	0	1	0	0	0	0	0	0	0	0	0	0	0	0	0
holi	0	0	0	0	0	0	0	0	0	0	0	0	0	0	0	0	0
feliz noche hasta maana night fun	0	0	0	0	0	0	0	0	0	0	0	0	0	1	0	0	0
first day since someone rude	0	1	0	0	0	0	0	0	0	0	0	0	0	0	0	0	0
backtowork tanksgood windofchange reload	0	0	0	0	0	0	0	0	0	0	0	0	0	0	0	0	0
hey droo tidetuesday younglove	0	0	0	0	0	0	0	0	0	0	0	0	0	0	0	0	0
safe positive affirmation	0	0	0	0	0	0	0	0	0	0	0	0	0	0	0	0	0
ho kid kids nice beautiful usa barbie marvel	0	0	0	0	1	0	0	0	0	0	0	0	0	0	0	0	0
safe positive affirmation	0	0	0	0	0	0	0	0	0	0	0	0	0	0	0	0	0
new shoes newbalance spring	0	0	0	0	0	0	0	0	0	0	0	0	0	0	0	0	0
safe positive affirmation	0	0	0	0	0	0	0	0	0	0	0	0	0	0	0	0	0
love seeing happy customers customer forsale fragrances frangipani cottonflower cottonc	1	0	0	0	0	1	0	0	0	0	0	0	0	0	0	0	0
hichew snickers crisper hargendazs caramel hawaii waikiki abcstore eat hot	0	0	0	0	0	0	0	0	0	0	0	0	0	0	0	0	0
safe positive affirmation	0	0	0	0	0	0	0	0	0	0	0	0	0	0	0	0	0
hello spring bring love peace rosy cheeks app instag app smile fun instahappy goodmo	1	0	1	0	0	0	0	0	0	0	0	0	0	1	0	0	0
mido 1 60 te quede grande felicidad amorpropio	0	0	0	0	0	0	0	0	0	0	0	0	0	0	0	0	0
mac cosme lipstick finally long sought good feeling everyday wear	0	0	0	0	0	0	0	0	0	0	0	0	0	0	0	0	1
dizem que um novo amor substitui velho ento bem vinda mel dog love	1	0	0	0	0	0	0	0	0	0	0	0	1	0	0	0	0
en modo estudio estudiomodeon beauty smile villa	0	0	1	0	0	0	0	0	0	0	0	0	0	0	0	0	0
ha dias cinzentos para quem sonha colorido boanoite	0	0	0	0	0	0	0	0	0	0	0	0	0	0	0	0	0
palmeiras elborn barcelona palmtrees palmtree nature sun sol sonne picoftheday	0	0	0	0	0	0	0	0	0	0	0	0	0	0	0	0	0
goodmorning dogood lovenothate livelife	0	0	0	0	0	0	0	0	0	0	0	0	0	0	0	0	0
loves store apple joy lovehim style playing free madison nyc	0	0	0	0	0	0	0	0	0	0	0	0	0	0	0	0	0
wondrous positive affirmation	0	0	0	0	0	0	0	0	0	0	0	0	0	0	0	0	0
wondrous positive affirmation	0	0	0	0	0	0	0	0	0	0	0	0	0	0	0	0	0
wondrous positive affirmation	0	0	0	0	0	0	0	0	0	0	0	0	0	0	0	0	0
tag bea ootd love relationshipgoals picoftheday photooftheday	1	0	0	0	0	0	0	0	0	0	0	0	0	0	0	0	0
need say lovehim smiles	0	0	0	0	0	0	0	0	0	0	0	0	0	0	0	0	0
quien dice que hoy se descansa gym cabezona insanity elite	0	0	0	0	0	0	0	0	0	0	0	0	1	0	0	0	0
holli	0	0	0	0	0	0	0	0	0	0	0	0	0	0	0	0	0
menyatu dengan alam bandung gmorning holiday abudabu	0	0	0	0	0	0	0	0	0	0	0	0	0	0	0	0	0
alhamdulillah safely arrived lets go sabah bah	0	0	0	0	0	0	0	0	0	0	0	0	0	0	0	0	0
par kid kids nice beautiful usa barbie marvel	0	0	0	0	1	0	0	0	0	0	0	0	0	0	0	0	0
direct holi	0	0	0	0	0	0	0	0	0	0	0	0	0	0	0	0	0
awesome people donate 125 go fund page	0	0	0	0	0	0	0	0	0	0	0	0	0	0	1	0	0
kung kini imong mauyab mag sugot kaha ka mga wala boot hahahahaha pataka lg ug post lt 3	0	0	0	0	0	0	0	0	0	0	0	0	0	0	0	0	0
enjoy life trip travelling traveler tourist hongdae seoul	0	0	0	1	0	0	0	0	0	0	0	0	0	0	0	0	0
im thankful everyone life right	0	0	0	1	0	0	0	0	0	0	0	0	0	0	0	0	0
expresso latte put smile face always playful	0	0	1	0	0	0	0	0	0	0	0	0	0	0	0	0	0
thankful freedom speech thankful positive	0	0	0	0	0	0	0	0	0	0	0	0	0	0	0	0	0
got blessings blessings blessings meow love plur goodvibes grateful hippie gypsy merm	1	0	0	0	0	0	0	0	0	0	0	0	0	0	0	0	0
ahora siento feliz feliz lunes foto lifestyle ready c7vip	0	0	0	0	0	0	0	0	0	0	0	0	0	0	0	0	0
hotel morning instagood love manami kakehashi philippines cebu	1	0	0	0	0	0	0	0	0	0	0	0	0	0	0	0	0
usj usj yamato nata nana l4l time	0	0	0	0	0	0	0	0	0	0	0	0	0	0	0	0	0
home kid kids nice beautiful usa barbie marvel	0	0	0	0	1	0	0	0	0	0	0	0	0	0	0	0	0
pacific beach san diego	0	0	0	0	0	0	0	0	0	0	0	0	0	0	0	0	0
masa kecil kurang bahagia hahahaha lol	0	0	0	0	0	0	0	0	0	0	0	0	0	0	0	0	0
holi	0	0	0	0	0	0	0	0	0	0	0	0	0	0	0	0	0
palmtrees palmtree palmeiras elborn barcelona picoftheday nature sun sol sonne	0	0	0	0	0	0	0	0	0	0	0	0	0	0	0	0	0
las mejores baes bffs friends love sleepover tragaderatime	1	0	0	0	0	0	0	0	0	0	0	0	0	0	0	0	0
pinm kid kids nice beautiful usa barbie marvel	0	0	0	0	1	0	0	0	0	0	0	0	0	0	0	0	0
brazil arraialdocabo errejota beach sunday paradise praia forno arraial	0	0	0	0	0	0	0	0	0	0	0	0	0	0	0	0	0
night dulce moments crazy rompiendounpocoladieta lovely	0	0	0	0	0	0	0	0	0	0	0	0	0	0	0	0	0
nene magicoo 3 losiento	0	0	0	0	0	0	0	0	0	0	0	0	0	0	0	0	0
friend	0	0	0	0	0	0	0	0	0	0	0	0	0	0	0	0	0
love instagood modelobeer tasty follow followme photooftheday tagforlikes	1	0	0	0	0	0	0	0	0	0	0	0	0	0	0	0	0
internationaldayofhappiness love goodvibes goodday monday	1	0	0	0	0	0	0	0	0	0	0	0	0	0	0	0	0
footprints adventure animallover goodvibes mylife explore hiking exploring	0	0	0	0	0	0	0	0	0	0	0	0	0	0	0	0	0
simple person hides thousand feelings behind happiest smile	0	0	1	0	0	0	0	0	0	0	0	0	0	0	0	0	0
want laugh lot laugh laugh laugh fun fun times love	1	0	0	0	0	0	0	0	0	0	0	0	0	2	0	0	0
hoy visit una principesa yamevi de abuelita enfamilia	0	0	0	0	0	0	1	0	0	0	0	0	0	0	0	0	0
100 refollowjp picoftheday photooftheday	0	0	0	0	0	0	0	0	0	0	0	0	0	0	0	0	0
hello spring bring love peace rosy cheeks app instag app smile fun instahappy goodmo	1	0	1	0	0	0	0	0	0	0	0	0	0	1	0	0	0
marie thearistocats disney classics love cute sweet cats kitten love tweegram	2	0	0	0	0	0	0	0	0	0	1	0	0	0	0	0	0
mcm makes smile bestfriend loveit smile luckyinlove grateful life	0	0	2	1	0	0	0	0	0	0	0	0	0	0	0	0	0
like4like lforl dibujo bisexual smile followher amor follow4followback intagram	0	0	1	0	0	0	0	0	0	0	0	0	0	0	0	0	0
mil gracias por esta noche de sorpresas os quieroo cumple 26	0	0	0	0	0	0	1	0	0	0	0	0	0	0	0	0	0
another day mycheekylife playanegra costarica yolo ocean sun beachlife beach sand love miche	1	1	0	0	0	0	0	0	0	0	0	0	0	0	0	0	0
many beautiful reasons happy girlsaretheprettiest brunette	0	0	0	0	1	1	0	0	0	0	0	0	0	0	0	0	0
wealthy healthy show law pain day 1 learn bad experiences blab	0	1	0	0	0	0	0	0	0	0	0	0	0	0	0	0	0
looks like girl going prom	0	0	0	0	0	0	0	0	1	0	0	0	0	0	0	0	0
quando pessoas felizes reparam se inverno ou vero life vibration	0	0	0	1	0	0	0	0	0	0	0	0	0	0	0	0	0
thankful growing thankful positive	0	0	0	0	0	0	0	0	0	0	0	0	0	0	0	0	0
happiness resides within rollercoaster life fit fitfam davidavocadowolf ijnip	0	0	0	1	0	0	0	0	0	0	0	0	0	0	0	0	0
hoy visit una principesa bella yamevi de abuelita	0	0	0	0	0	0	1	0	0	0	0	0	0	0	0	0	0
like4like lforl dibujo bisexual smile followher amor follow4followback intagram	0	0	1	0	0	0	0	0	0	0	0	0	0	0	0	0	0
cap kid kids nice beautiful usa barbie marvel	0	0	0	0	1	0	0	0	0	0	0	0	0	0	0	0	0
trouble dont risk anything risk erica jong love women	1	0	0	0	0	0	0	0	0	0	0	0	0	0	0	0	0
younique makeup beauty sexy buy cosmetics baby love want order shop	1	0	0	0	0	0	0	0	0	0	0	0	0	0	0	0	0
palmtrees palmtree palmeiras elborn barcelona painting picoftheday sun sol	0	0	0	0	0	0	0	0	0	0	0	0	0	0	0	0	0
get pharrell thevoice	0	0	0	0	0	0	0	0	0	0	0	0	0	0	0	0	0
mivida hijo	0	0	0	0	0	0	0	0	0	0	0	0	0	0	0	0	0
hoy visit una principesa yamevi de abuelita enfamilia	0	0	0	0	0	0	1	0	0	0	0	0	0	0	0	0	0
f g tantalize spraytan themoreyouknow cancer health healthy love babe	1	0	0	0	0	0	0	0	0	0	0	0	0	0	0	0	0
info ready healthy r u ready get primal caveman grainfree	0	0	0	0	0	0	0	0	0	0	0	0	0	0	0	0	0
mood today new nail	0	0	0	0	0	0	0	0	0	0	0	0	0	0	0	1	0
yay got box owlcratebox owlcratemarch2016 love books	1	0	0	0	0	0	0	0	0	0	0	0	0	0	0	0	0
new shoes nike favorite thank	0	0	0	0	0	0	0	0	0	0	0	0	0	0	0	0	0
want	0	0	0	0	0	0	0	0	0	0	0	0	0	0	0	0	0
ns na cama frio love follow photooftheday beautiful self picoftheday	1	0	0	0	1	0	0	0	0	0	0	0	0	0	0	0	0
yes donut foods lol lol true donut donuts happiness	0	0	0	0	0	0	0	0	0	0	0	0	0	0	0	0	0
	0	0	0	0	0	0	0	0	0	1	0	0	0	0	0	0	0
	0	0	0	0	0	0	0	0	0	1	0	0	0	0	0	0	0
easter nude	0	0	0	0	0	0	0	0	0	0	0	0	0	0	0	0	0
soy un pequeo gigante 3 littlegiant bored gayboys gayguys gaymen ifeelgood	0	0	0	0	0	0	0	0	0	0	0	0	0	0	0	0	0
spring everyone tampa oldsmar tarpon florida 2016	0	0	0	0	0	0	0	0	0	0	0	0	0	0	0	0	0
ruta zukauskaite 2 credits imdb could happyer actress london determined	0	0	0	0	0	0	0	0	0	0	0	0	0	0	0	0	0
santai sambil nonton bola relax realmadrid halamadrid taliwan football good	0	0	0	0	0	0	0	0	0	0	0	0	0	0	0	0	1
holi	0	0	0	0	0	0	0	0	0	0	0	0	0	0	0	0	0
porque contigo es todo diferente quiero estar tu lado love goodnight sweetdreams	1	0	0	0	0	0	0	0	0	0	0	0	0	0	0	0	0
beautiful day lake almost full yoga yogaeverydamnday march	0	1	0	0	1	0	0	0	0	0	0	0	0	0	0	0	0
flourish wonderful day fun flowers wonderfull wonderfulindonesia orchid	0	1	0	0	0	0	0	0	0	0	0	0	0	1	0	0	0
smile blonde puppy cute vibes	0	0	1	0	0	0	0	0	0	0	1	0	0	0	0	0	0
dios se manda con sus detalles el sol brillando al mximo frente escuchar en la voz principal garca en vivo	0	0	0	0	0	0	0	0	0	0	0	1	0	0	0	0	0
tuesday	0	0	0	0	0	0	0	0	0	0	0	0	0	0	0	0	0
ironman ironman monterrey	0	0	0	0	0	0	0	0	0	0	0	0	0	0	0	0	0
like4like lforl dibujo bisexual smile followher amor follow4followback intagram	0	0	1	0	0	0	0	0	0	0	0	0	0	0	0	0	0
lilies seem blossoms choice right chicago fragrance cheerful	0	0	0	0	0	0	0	0	0	0	0	0	0	0	0	0	0
hello spring bring love peace rosy cheeks app instag app smile fun instahappy goodmo	1	0	1	0	0	0	0	0	0	0	0	0	0	1	0	0	0
beh non penserai mica che sono stato io vero zak dog animal love akab	1	0	0	0	0	0	0	0	0	0	0	0	0	0	0	0	0
hello spring bring love peace rosy cheeks app instag app smile fun instahappy goodmo	1	0	1	0	0	0	0	0	0	0	0	0	0	1	0	0	0
think beauty still left around quote	0	0	0	0	0	0	0	0	0	0	0	0	0	0	0	0	0
11 secrets people know happiness lifegoals beingpositive	0	0	0	0	0	0	0	0	0	0	0	0	0	0	1	0	0
spring cleaning kinda mood springcleaning	0	0	0	0	0	0	0	0	0	0	0	0	0	0	0	0	0
acabando en lunes santo roco bestfriends selfie smile brothers	0	0	1	0	0	0	0	0	0	0	0	0	0	0	0	0	0
ajjajaj faces smile crazy cousin	0	0	1	0	0	0	0	0	0	0	0	0	0	0	0	0	0
caras foto 5 pic picoftheday girl lady foxylady cute smile selfie clown	0	0	1	0	0	0	0	0	0	0	1	0	0	0	0	0	0
bieng single	0	0	0	0	0	0	0	0	0	0	0	0	0	0	0	0	0
fitspo eatclean fitness health love	1	0	0	0	0	0	0	0	0	0	0	0	0	0	0	0	0
like eyedrop kitkat kohgendo amino collagen japan japanmania love music	1	0	0	0	0	0	0	0	1	0	0	0	0	0	0	0	0
hulk kid kids nice beautiful usa barbie marvel	0	0	0	0	1	0	0	0	0	0	0	0	0	0	0	0	0
behind skateboard bigcity london skate sk8 skatelife pale cyberghetto	0	0	0	0	0	0	0	0	0	0	0	0	0	0	0	0	0
friend told makeup looked fierce wanted take picture friend said ow cateye sharp	0	0	0	0	0	0	0	0	0	0	0	0	0	0	0	0	0
pega kid kids nice beautiful usa barbie marvel	0	0	0	0	1	0	0	0	0	0	0	0	0	0	0	0	0
even april received first gift thanks sis love loveit	1	0	0	0	0	0	0	0	0	0	0	0	0	0	0	0	0
relaxing spa day clarice house bury st edmunds weekends ago sister went clar calm	0	1	0	0	0	0	0	0	0	0	0	0	0	0	0	0	0
full video bio health fitness girls cute summer blur sun fun dog hair beach	0	0	0	0	0	0	0	0	0	0	1	0	0	1	0	0	0
weekend progress update	0	0	0	0	0	0	0	0	0	0	0	0	0	0	0	0	0
new grad2016 uw free jump joy newadventures photooftheday instagood	0	0	0	0	0	0	0	0	0	0	0	0	0	0	0	0	0
love instagood tbt cute follow followme photooftheday beautiful selfie picoftheday like4li	1	0	0	0	1	0	0	0	0	0	1	0	0	0	0	0	0
japanese drum game friend fun smile japan tokyo great awesome cool nice	0	0	1	0	0	0	0	0	0	0	0	0	0	1	0	0	0
caras foto 4 pic picoftheday girl lady foxylady cute smile selfie clown	0	0	1	0	0	0	0	0	0	0	1	0	0	0	0	0	0
holi	0	0	0	0	0	0	0	0	0	0	0	0	0	0	0	0	0
many 4k girls list many missed amp disappointed	0	0	0	0	0	0	0	1	0	0	0	0	0	0	0	0	0
get pharrell thevoice	0	0	0	0	0	0	0	0	0	0	0	0	0	0	0	0	0
mother day	0	1	0	0	0	0	0	0	0	0	0	0	0	0	0	0	0
enjoying raw tonight	0	0	0	0	0	0	0	0	0	0	0	0	0	0	0	0	0
tumba la traja mami robusbday enjoy trajineras nativitas xochimilco bday	0	0	0	0	0	0	0	0	0	0	0	1	0	0	0	0	0
morning instagood love manami kakehashi philippines flower beauty cebu morning	1	0	0	0	0	0	0	0	0	0	0	0	0	0	0	0	0
holi	0	0	0	0	0	0	0	0	0	0	0	0	0	0	0	0	0
life everyday	0	0	0	1	0	0	0	0	0	0	0	0	0	0	0	0	0
behind skateboard bigcity london skate sk8 skatelife pale cyberghetto	0	0	0	0	0	0	0	0	0	0	0	0	0	0	0	0	0
tempe kid kids nice beautiful usa barbie marvel	0	0	0	0	1	0	0	0	0	0	0	0	0	0	0	0	0
un tardecita con estass lokitass tia hermani kris rey rayth	0	0	0	0	0	0	0	0	0	0	0	0	0	0	0	0	0
boanoite girl goodnight vibe goodvibe positividade life amor love	1	0	0	1	0	0	0	0	0	0	0	0	0	0	0	0	0
nothingisordinary nationalflowerday dsfloral lookoutside love outdoors summer dscolor	1	0	0	0	0	0	0	0	0	0	0	0	0	0	0	0	0
obrigada pug voador thankyou pug dog voar felicidade	0	0	0	0	0	0	0	0	0	0	0	0	0	0	0	0	0
mother day	0	1	0	0	0	0	0	0	0	0	0	0	0	0	0	0	0
vekok asli v hi smile boys girl goodmorning morning lol ngakak mlipir ah	0	0	1	0	0	0	0	0	0	0	0	0	0	0	0	0	0
time keeps ticking away devo guy	0	0	0	0	0	0	0	0	0	0	0	0	0	0	0	0	0
keep attendees get market eventmarketing works mktg	0	0	0	0	0	0	0	0	0	0	0	0	0	0	0	0	0
awhile full body pic fellinggood	0	0	0	0	0	0	0	0	0	0	0	0	0	0	0	0	0
easter	0	0	0	0	0	0	0	0	0	0	0	0	0	0	0	0	0
family funny eat pizza sunday nightout thankyougod	0	0	0	0	0	0	0	0	0	0	0	0	0	0	0	0	0
pagi frenz yuk memiliki kesadaran untuk menjaga sehingga ketersediaan air bersih morning hariairsedunia radiosib	0	0	0	0	0	0	0	0	0	0	0	0	0	0	0	0	0
peace hippie sunflowers happiness positiveenergy positivevibesonly positivevibes	0	0	0	0	0	0	0	0	0	0	0	0	0	0	0	0	0
success sum small actions taken daily gotime healthy dailygreatness	0	0	0	0	0	0	0	0	0	0	0	0	0	0	0	0	0
consistently squatting 500lbs	0	0	0	0	0	0	0	0	0	0	0	0	0	0	0	0	0
quemtemdentetaaqui vivalavida	0	0	0	0	0	0	0	0	0	0	0	0	0	0	0	0	0
beautiful oceano mar rocas aves beautiful vista good day otoo	0	1	0	0	2	0	0	0	0	0	0	0	0	0	0	0	1
frases lavidaenletras inshot girls cute summer blur sun fun dog hair beach hot cool fashion	0	0	0	0	0	0	0	0	0	0	1	0	0	1	0	0	0
eantv full link bio inshot girls cute summer blur sun fun dog hair beach	0	0	0	0	0	0	0	0	0	0	1	0	0	1	0	0	0
control anything else find way accept decide happy regardless	0	0	0	0	0	1	0	0	0	0	0	0	0	0	0	0	0
holi	0	0	0	0	0	0	0	0	0	0	0	0	0	0	0	0	0
buen entrenamiento pero el resfrio acompaa mucho zumbafitness gym	0	0	0	0	0	0	0	0	0	0	0	0	0	0	0	0	0
caras foto 3 pic picoftheday girl lady foxylady cute smile selfie clown	0	0	1	0	0	0	0	0	0	0	1	0	0	0	0	0	0
white beannie friends boy girl love shopping	1	0	0	0	0	0	0	0	0	0	0	0	0	0	0	0	0
liked quote decide photooftheday picoftheday bestoftheday instadaily like follow smile fun beaut	0	0	1	0	0	0	0	0	1	0	0	0	0	1	0	0	0
go tip goodies coming together internationaldayofhappiness	0	0	0	0	0	0	0	0	0	0	0	0	0	0	0	0	0
2016 philippine international pyromusical competition march192016 fireworks	0	0	0	0	0	0	0	0	0	0	0	0	0	0	0	0	0
sometimes scrolling ur feed pop yay think mid night jobs make b	0	0	0	0	0	0	0	0	0	0	0	0	0	0	0	0	0
relaxed free spring sun denim clothing tumblrboy flowers sweet lovely fierce	0	0	0	0	0	0	0	0	0	0	0	0	0	0	0	0	0
say cheese cow govegan gogreen vegan crueltyfree oneday	0	0	0	0	0	0	0	0	0	0	0	0	0	0	0	0	0
live girlfriend latina webcammodel female colombia babe webcam pussy	0	0	0	0	0	0	0	0	0	0	0	0	0	0	0	0	0
candid candid muaraenimcetar dmc dmcmuaraenim apalahapalah sukasukakita	0	0	0	0	0	0	0	0	0	0	0	0	0	0	0	0	0
black beannie friends boy girl shopping	0	0	0	0	0	0	0	0	0	0	0	0	0	0	0	0	0
inshot girls cute summer blur sun fun dog hair beach hot cool fashion	0	0	0	0	0	0	0	0	0	0	1	0	0	1	0	0	0
aqu con una preciosura de mujer su belleza tiene lmites	0	0	0	0	0	0	1	0	0	0	0	0	0	0	0	0	0
naturephotography nature naturelovers beautiful outdoors photography sunshine doglover dogsontwitter	0	0	0	0	1	0	0	0	0	0	0	0	0	0	0	0	0
caras foto 2 pic picoftheday girl lady foxylady cute smile selfie clown	0	0	1	0	0	0	0	0	0	0	1	0	0	0	0	0	0
perfeitas chapadadosveadeiros instagarden floresdocaminho flores flower natureza relax delicadeza b	0	0	0	0	0	0	0	0	0	0	0	0	0	0	0	0	0
siguemeytesigo 1 like linda cute morena feliz crazy follow followme followback followher followm	0	0	0	0	0	0	0	0	1	0	1	0	0	0	0	0	0
thankful inspiration thankful positive	0	0	0	0	0	0	0	0	0	0	0	0	0	0	0	0	0
perfeitas chapadadosveadeiros instagarden floresdocaminho flores flower natureza relax delicadeza b	0	0	0	0	0	0	0	0	0	0	0	0	0	0	0	0	0
cutest video ever adorable aw cute omg goals puppy cutebaby baby vine	0	0	0	0	0	0	0	0	0	0	1	0	0	0	0	0	0
america imagine ourfuture store stillsanders hrc restitution	0	0	0	0	0	0	0	0	0	0	0	0	0	0	0	0	0
si con todo lo que tienes eres feliz con todo lo que te falta tampoco day	0	1	0	0	0	0	0	0	0	0	0	0	2	0	0	0	0
thank	0	0	0	0	0	0	0	0	0	0	0	0	0	0	0	0	0
happy know click smiles dimple feelings thankyoulord	0	0	0	0	0	1	0	0	0	0	0	0	0	0	0	0	0
perfeitas chapadadosveadeiros instagarden floresdocaminho flores flower natureza relax delicadeza b	0	0	0	0	0	0	0	0	0	0	0	0	0	0	0	0	0
por fin recib mis regalitos que trajeron desde londres gracias glad	0	0	0	0	0	0	0	0	0	0	0	0	1	0	0	0	0
hom kid kids nice beautiful usa barbie marvel	0	0	0	0	1	0	0	0	0	0	0	0	0	0	0	0	0
use feet take toward good things oh yea use brain goodday textmeee	0	0	0	0	0	0	0	0	0	0	0	0	0	0	0	0	1
chilled day today selfie tuesday autumm smile chill chillday	0	1	1	0	0	0	0	0	0	0	0	0	0	0	0	1	0
bought tulips yesterday bloomed beautifully flowers spring	0	0	0	0	0	0	0	0	0	0	0	0	0	0	0	0	0
big shout helping problem awesome customerservice	0	0	0	0	0	0	0	0	0	0	0	0	0	0	0	0	0
quotes	0	0	0	0	0	0	0	0	0	0	0	0	0	0	0	0	0
muy emo conpololi jardnbotnico utalca talca love lunes	1	0	0	0	0	0	0	0	0	0	0	0	0	0	0	0	0
muy emo conpololi jardnbotnico utalca talca love lunes	1	0	0	0	0	0	0	0	0	0	0	0	0	0	0	0	0
dormir con nuevos motivos para seguir sonriendo	0	0	0	0	0	0	0	0	0	0	0	0	0	0	0	0	0
deadlifts made legs tremble still full lower body work killed legday majorsoreness	0	0	0	0	0	0	0	0	0	0	0	0	0	0	0	0	0
favorite rhythm smile love	1	0	1	0	0	0	0	0	0	0	0	0	0	0	0	0	0
boanoite sdv follow4follow feliz love aliana minha lindaaa caapava	1	0	0	0	0	0	0	0	0	0	0	0	0	0	0	0	0
never much cat person cat fell asleep lap move decides lapcat	0	0	0	0	0	0	0	0	0	0	0	0	0	0	0	0	0
