lovely lunch jess authentic italian restaurant shambles york daughter mum	0	0	0	0	0	0	0	0	0	0	0	0	0	0	0	0	0
beauty beautiful behappy girl	0	0	0	0	1	0	0	0	0	0	0	0	0	0	0	0	0
mis segundos de fama lollapaloozacl2016 lollacl fiesta epicmoment santiagodechile	0	0	0	0	0	0	1	0	0	0	0	0	0	0	0	0	0
say goodread goodbook page turning fast paced think tom peter	0	0	0	0	0	0	0	0	0	0	0	0	0	0	0	0	0
say goodread goodbook page turning fast paced think tom peter	0	0	0	0	0	0	0	0	0	0	0	0	0	0	0	0	0
cold friends smile l4l l taba egypt	0	0	1	0	0	0	0	0	0	0	0	0	0	0	0	0	0
welcome seascape annandale sea scape amazing respect love	1	0	0	0	0	0	0	0	0	0	0	0	0	0	0	0	0
nog even wachten dutch bike fiets sunstainable	0	0	0	0	0	0	0	0	0	0	0	0	0	0	0	0	0
meeting katona lecture even better meeting rockstar math extremal graphtheory great	0	0	0	0	0	0	0	0	0	0	0	0	0	0	0	0	0
clients love easy use web based mobile platform 98 customer retention rate proves customerretention	1	0	0	0	0	0	0	0	0	0	0	0	0	0	0	0	0
stone used stone beautiful cute nice good family lovers	0	0	0	0	1	0	0	0	0	0	1	0	0	0	0	0	1
everything beautiful love life world fun sun nature gym work follow success cute girl	1	0	0	1	1	0	0	0	0	0	1	0	0	1	0	0	0
everything beautiful love life world fun sun nature gym work follow	1	0	0	1	1	0	0	0	0	0	0	0	0	1	0	0	0
din wa aleykoum salam je viens de finir mon planning de la semaine et de valider mes tches de lundi bonne semaine vs	0	0	0	0	0	0	4	0	0	0	0	1	0	0	0	0	0
got driver license	0	0	0	0	0	0	0	0	0	0	0	0	0	0	0	0	0
makeup perfectmakeup loveit happiness selfie hi thisisme girl great	0	0	0	0	0	0	0	0	0	0	0	0	0	0	0	0	0
soy un nio guapo lo sabia 0 selfie 123 redhair expander sectum pajarita	0	0	0	0	0	0	0	0	0	0	0	0	0	0	0	0	0
best health lawofattraction resources healing altwaystoheal healthy peace joy love	1	0	0	0	0	0	0	0	0	0	0	0	0	0	0	0	0
smile queen street	0	0	1	0	0	0	0	0	0	0	0	0	0	0	0	0	0
share love follow like please favorite love motivational success quote quotes	2	0	0	0	0	0	0	0	1	0	0	0	0	0	0	0	0
52 4th untimed mock cfalevel3 going leisurely pace nervous excited overwhelmed	0	0	0	0	0	0	0	0	0	0	0	0	0	0	0	0	0
monday motivation yougotthis monday live	0	0	0	0	0	0	0	0	0	0	0	0	0	0	0	0	0
great day nice great day sunny sea walking	0	2	0	0	0	0	0	0	0	0	0	0	0	0	0	0	0
giiiiirl put bubbleology bubbleologysk central shopping monday fun	0	0	0	0	0	0	0	0	0	0	0	0	0	1	0	0	0
etkinlik sonras ailecek kutlama family seaside lunch pendik marina	0	0	0	0	0	0	0	0	0	0	0	0	0	0	0	0	0
bostonmusic bostontalent bostonnewmusic trap girls beautiful wow cute girlfriend	0	0	0	0	1	0	0	0	0	0	1	0	0	0	0	0	0
par kid kids nice beautiful usa barbie marvel	0	0	0	0	1	0	0	0	0	0	0	0	0	0	0	0	0
cuddling teddy bear pomeranian pompom dogs bestdogever ilovemypom pompom dogoftheday pic	0	0	0	0	0	0	0	0	0	0	0	0	0	0	0	0	0
autofollow instamood beautiful	0	0	0	0	1	0	0	0	0	0	0	0	0	0	0	0	0
smile krklareli	0	0	1	0	0	0	0	0	0	0	0	0	0	0	0	0	0
quand deux jobs offrent toi le mme jour	0	0	0	0	0	0	0	0	0	0	0	0	0	0	0	0	0
toptags days tags day smile fun instahappy goodmood sohappy happier excited feel	0	1	1	0	0	0	0	0	0	0	0	0	0	1	0	0	0
make everyone happy buy pizza basically thing pizza firenza pizzahappiness	0	0	0	0	0	1	0	0	0	0	0	0	0	0	0	0	0
beautiful beautiful mega wunderbar amazing hairstyle frisur bride schmuck haare haarschmuck	0	0	0	0	2	0	0	0	0	0	0	0	0	0	0	0	0
plapeople people great week everyone officelife monday	0	0	0	0	0	0	0	0	0	0	0	0	0	0	1	0	0
un da de esos que te animas	0	0	0	0	0	0	1	0	0	0	0	0	1	0	0	0	0
healing lawofattraction altwaystoheal healthy healing peace joy love	1	0	0	0	0	0	0	0	0	0	0	0	0	0	0	0	0
mood mood motherfucker swag piercings queen piercing tattoo jager pitbull selfie dope omg	0	0	0	0	0	0	0	0	0	0	0	0	0	0	0	0	0
lolitavie spring mondaymantra spring printemps lolitalempicka	0	0	0	0	0	0	0	0	0	0	0	0	0	0	0	0	0
vegan southerngirl countrylife countrygirl countrystyle fun stuff countrylove	0	0	0	0	0	0	0	0	0	0	0	0	0	1	0	0	0
welcome seascape annandale sea scape amazing respect love	1	0	0	0	0	0	0	0	0	0	0	0	0	0	0	0	0
shall free hd doggy fractals mushrooms rainbow spirals trippy wtf	0	0	0	0	0	0	0	0	0	0	0	0	0	0	0	0	0
internationaldayofhappiness behappy happiness	0	0	0	0	0	0	0	0	0	0	0	0	0	0	0	0	0
blessed	0	0	0	0	0	0	0	0	0	0	0	0	0	0	0	0	0
cuando adoptas el estilo look girl style hair braid cool hairstyle positive	0	0	0	0	0	0	0	0	0	0	0	0	0	0	0	0	0
paraliminals heal altwaystoheal healthy healing peace joy love	1	0	0	0	0	0	0	0	0	0	0	0	0	0	0	0	0
quote quotes positive amazing entrepreneur motivation inspiration positively smile freedom	0	0	1	0	0	0	0	0	0	0	0	0	0	0	0	0	0
spring yellow flowers arrived lynn ilovemyjob	0	0	0	0	0	0	0	0	0	0	0	0	0	0	0	0	0
ready lionel beuvens time tomorrow hotclub gent	0	0	0	0	0	0	0	0	0	0	0	0	0	0	0	0	0
5 reasons stop sad happy via sad happiness sadness duality	0	0	0	0	0	1	0	0	0	0	0	0	0	0	0	0	0
hello spring spring mondaymotivation	0	0	0	0	0	0	0	0	0	0	0	0	0	0	0	0	0
home kid kids nice beautiful usa barbie marvel	0	0	0	0	1	0	0	0	0	0	0	0	0	0	0	0	0
kisses picoftheday instagood instamoments picture lovely dream like like4like	0	0	0	0	0	0	0	0	1	0	0	0	0	0	0	0	0
conversation library gobo worldpuppetryday fun puppets	0	0	0	0	0	0	0	0	0	0	0	0	0	1	0	0	0
new farida guitar faridaguitars musicblog music followme beautiful solidwood	0	0	0	0	1	0	0	0	0	0	0	0	0	0	0	0	0
mrbluesky musicmonday	0	0	0	0	0	0	0	0	0	0	0	0	0	0	0	0	0
pinm kid kids nice beautiful usa barbie marvel	0	0	0	0	1	0	0	0	0	0	0	0	0	0	0	0	0
jeronimmoguy na young shy naughty xxx wet hot nasty sexy nude porn slut kinky horny	0	0	0	0	0	0	0	0	0	0	0	0	0	0	0	0	0
well say say today alright still alot done drop amp collections clients need food	0	0	0	0	0	0	0	1	0	0	0	0	0	0	0	1	0
inshot girls cute summer blur sun fun dog hair beach hot cool fashion	0	0	0	0	0	0	0	0	0	0	1	0	0	1	0	0	0
inshot girls cute summer blur sun fun dog hair beach hot cool fashion	0	0	0	0	0	0	0	0	0	0	1	0	0	1	0	0	0
navro z ayyomi barchamizga muborak bo lsin aktrisa uzb uzbek navruz	0	0	0	0	0	0	0	0	0	0	0	0	0	0	0	0	0
whatever makes raises vibrations	0	0	0	0	0	0	0	0	0	0	0	0	0	0	0	0	0
meditation made easy altwaystoheal healthy healing peace joy love	1	0	0	0	0	0	0	0	0	0	0	0	0	0	0	0	0
buenavistasocialclub cd buena social club cuba goodvibes	0	0	0	0	0	0	0	0	0	0	0	0	0	0	0	0	0
estuvo bueno nuestro fin de semana	0	0	0	0	0	0	1	0	0	0	0	0	0	0	0	0	0
bounce back bad mood kinda day selfcare happiness happinessproject inspiration	0	1	0	0	0	0	0	0	0	0	0	0	0	0	0	0	0
i240 157 sale fun	0	0	0	0	0	0	0	0	0	0	0	0	0	1	0	0	0
never stop smiling smile justme like4like sc jordanzitop	0	0	1	0	0	0	0	0	0	0	0	0	0	0	0	0	0
luned di merda voi come andato lunedi monday smile face eyes fun pic	0	0	1	0	0	0	0	0	0	0	0	0	0	1	0	0	0
mothersday mom fun time wiz family soulmate first love	1	0	0	0	0	0	0	0	0	0	0	0	0	1	0	0	0
inshot girls cute summer blur sun fun dog hair beach hot cool fashion	0	0	0	0	0	0	0	0	0	0	1	0	0	1	0	0	0
stuck idea designing make people billboard make warm inside mondaymotivation	0	0	0	0	0	0	0	0	0	0	0	0	0	0	1	0	0
scary think month 5 days james together year boyfriend anniversary	0	0	0	0	0	0	0	0	0	0	0	0	0	0	0	0	0
sleep amp eat brilliant cake food instagood instalike instadaily	0	0	0	0	0	0	0	1	0	0	0	0	0	0	0	0	0
lolitavie spring mondaymantra spring printemps lolitalempicka	0	0	0	0	0	0	0	0	0	0	0	0	0	0	0	0	0
saw roaming sheep chickens cows awwww countrylife animals	0	0	0	0	0	0	0	0	0	0	0	0	0	0	0	0	0
work monday monday mondaymotivation newweek new week inspiration momtivation	0	0	0	0	0	0	0	0	0	0	0	0	0	0	0	0	0
etsy etsyseller shopping shopetsy fashion handmadelove	0	0	0	0	0	0	0	0	0	0	0	0	0	0	0	0	0
put happy easter marshalls got goodies theyll never expect easter easterbasket	0	0	0	0	0	1	0	0	0	0	0	0	0	0	0	0	0
700studios 700main wiius love life smile laugh inspire inspiration motivate motivation li	1	0	1	1	0	0	0	0	0	0	0	0	0	0	0	0	0
melanin writer internationalhappinessday longisland goodafternoon monday good mondays comedy	0	0	0	0	0	0	0	0	0	0	0	0	0	0	0	0	1
instapic barbara0418 ciao chianti toscana tramonto cerbaia amici friends sky night notte	0	0	0	0	0	0	0	0	0	0	0	0	0	0	0	0	0
humpday nascarpics nascar mattkenseth	0	0	0	0	0	0	0	0	0	0	0	0	0	0	0	0	0
time	0	0	0	0	0	0	0	0	0	0	0	0	0	0	0	0	0
getting dolled date night selfie selfiewhore selfiewanker smile love datenight brunette blu	1	0	1	0	0	0	0	0	0	0	0	0	0	0	0	0	0
ya podemos dejar de vernos ni un solo da haha friends amazing love family	1	0	0	0	0	0	1	0	0	0	0	0	0	0	0	0	0
last friday night friends friendship cdmx drinks fun funny happiness	0	0	0	0	0	0	0	0	0	0	0	0	0	1	0	0	0
thanks recent follow grateful connect monday	0	0	0	0	0	0	0	0	0	0	0	0	0	0	0	0	0
quote typography love smile relationship goals motivation inspiration instagram followme life wo	1	0	1	1	0	0	0	0	0	0	0	0	0	0	0	0	0
use mind heal body altwaystoheal healthy healing peace joy love	1	0	0	0	0	0	0	0	0	0	0	0	0	0	0	0	0
chocolate de brasil chocolet brasil chocolate ilovechocolate detalles	0	0	0	0	0	0	1	0	0	0	0	0	0	0	0	0	0
lunchtime almoo almuerzo oquis nhoque molho bolognesa ilikebrazil travelphoto saopaulo	0	0	0	0	0	0	0	0	0	0	0	0	0	0	0	0	0
quote typography love smile relationship goals motivation inspiration instagram followme life wo	1	0	1	1	0	0	0	0	0	0	0	0	0	0	0	0	0
love amp live without forest amp poetry amp twitter great day	1	1	0	0	0	0	0	3	0	0	0	0	0	0	0	0	0
billmurray xavier sad dont vs hailsatan	0	0	0	0	0	0	0	0	0	0	0	0	0	0	0	0	0
holi	0	0	0	0	0	0	0	0	0	0	0	0	0	0	0	0	0
navro z ayyomi barchamizga muborak bo lsin aktrisa uzb uzbek navruz	0	0	0	0	0	0	0	0	0	0	0	0	0	0	0	0	0
cap kid kids nice beautiful usa barbie marvel	0	0	0	0	1	0	0	0	0	0	0	0	0	0	0	0	0
beso selfie kiss instaphoto instamoment instapic amigos pic moment sinfiltro	0	0	0	0	0	0	0	0	0	0	0	0	0	0	0	0	0
detras de una gran mujer siempre hay otra criticando q cren vivetuvida smile	0	0	1	0	0	0	1	0	0	0	0	0	0	0	0	0	0
el mejor regalo del mundo mundial graciasgio plantacarnivora venusatrapamoscas felicheee unab kitcul	0	0	0	0	0	0	0	0	0	0	0	0	0	0	0	0	0
casa nueva	0	0	0	0	0	0	0	0	0	0	0	0	0	0	0	0	0
see another friend join work online camp proud writer entrepreneur creativeindustries job money	0	0	0	0	0	0	0	0	0	0	0	0	0	0	0	0	0
boatarde segundona segunda goodafternoon smile sorria sorrir	0	0	1	0	0	0	0	0	0	0	0	0	0	0	0	0	0
hk hkgirl hkboy hkig iggirl love beautiful fashion street style girl colorful smile stylish	1	0	1	0	1	0	0	0	0	0	0	0	0	0	0	0	0
scary read book like thrillers haunted within bookclubs	0	0	0	0	0	0	0	0	1	0	0	0	0	0	0	0	0
blue	0	0	0	0	0	0	0	0	0	0	0	0	0	0	0	0	0
mis babys kiser marley smile magic soar friends actrizcolombia vida juventud naturaleza paz pi	0	0	1	0	0	0	0	0	0	0	0	0	0	0	0	0	0
buen comienzo de semana spring primavera flowers monday monday sunshine	0	0	0	0	0	0	1	0	0	0	0	0	0	0	0	0	0
always streisand	0	0	0	0	0	0	0	0	0	0	0	0	0	0	0	0	0
yea happy internationalhappinessday	0	0	0	0	0	1	0	0	0	0	0	0	0	0	0	0	0
kicking bios ass	0	0	0	0	0	0	0	0	0	0	0	0	0	0	0	0	0
aprovechar las sonrisas genuinas photooftheday picoftheday smile happiness hair husband love lovely	1	0	1	0	0	0	0	0	0	0	0	0	0	0	0	0	0
ya est aqu la semana santa qu planes tenis nosotros os damos una opcin entrar en pasarlo bien	0	0	0	0	0	0	0	0	0	0	0	1	0	0	0	0	0
loving tongue silasjoseph sunshine spring beautiful bestkidever	0	0	0	0	1	0	0	0	0	0	0	0	0	0	0	0	0
oxy bowling perfect monday night paiiss wait bowling chinese monday	0	0	0	0	0	0	0	0	0	0	0	0	0	0	0	0	0
need something springbreak come visit amazing cats weather great cats efrc tigers lion	0	0	0	0	0	0	0	0	0	0	0	0	0	0	0	0	0
alyoz biz yaa iyerinden gn iinde akplast cool	0	0	0	0	0	0	0	0	0	0	0	0	0	0	0	0	0
siblings sibling selfie vain cute cutie church love lovely meh	1	0	0	0	0	0	0	0	0	0	1	0	0	0	0	0	0
love boy bambino instagood smile follow espaa hipster tbt followme zaragoza beautiful	1	0	1	0	1	0	0	0	0	0	0	0	0	0	0	0	0
navro z ayyomi barchamizga muborak bo lsin xonanda uzb uzbek navruz	0	0	0	0	0	0	0	0	0	0	0	0	0	0	0	0	0
scary read book like thrillers haunted within amreading	0	0	0	0	0	0	0	0	1	0	0	0	0	0	0	0	0
prxima compra appleevent applekeynote dolaryanosubas ahuevobandaahuevo	0	0	0	0	0	0	0	0	0	0	0	0	0	0	0	0	0
bosse beautiful photooftheday sweet instagood girl 2016 greeneyes felicidad moment mome	0	0	0	0	1	0	0	0	0	0	0	0	0	0	0	0	0
spread around positivevibes share beehappyco	0	0	0	0	0	0	0	0	0	0	0	0	0	0	0	0	0
met 100 expectations camps happy fitness bootcamp exercise reviews	0	0	0	0	0	1	0	0	0	0	0	0	0	0	0	0	0
chocolate de brasil chocolet brasil chocolate ilovechocolate detalles	0	0	0	0	0	0	1	0	0	0	0	0	0	0	0	0	0
bosse beautiful photooftheday sweet instagood girl 2016 greeneyes felicidad moment mome	0	0	0	0	1	0	0	0	0	0	0	0	0	0	0	0	0
n healthy strongest species survive intelligent one responsive change	0	0	0	0	0	0	0	0	0	0	0	0	0	0	0	0	0
tv looking forward braxton boys episode glass wine aneyeforaneye	0	0	0	0	0	0	0	0	0	0	0	0	0	0	0	0	0
hello spring favorite spring sunshine	0	0	0	0	0	0	0	0	0	0	0	0	0	0	0	0	0
florida baseball sunshine sun amazing warmweather space coast stadium	0	0	0	0	0	0	0	0	0	0	0	0	0	0	0	0	0
good mood	0	0	0	0	0	0	0	0	0	0	0	0	0	0	0	0	1
blond today blond blondjunkies redkennl redkennyc redkenfifthavenue	0	0	0	0	0	0	0	0	0	0	0	0	0	0	0	1	0
think passed exams today anatomy physiology massage student smi	0	0	0	0	0	0	0	0	0	0	0	0	0	0	0	1	0
beatiful travel love xoxo funny holiday goodtime beaty tree candycam vsc	1	0	0	0	0	0	0	0	0	0	0	0	0	0	0	0	0
inthemirror inthelift lastdayofterm goatsofinstagram goatlove shenanigansatwork	0	0	0	0	0	0	0	0	0	0	0	0	0	0	0	0	0
myworld 4miesice kochany loveday instagirl instaboy polishgirl polishboy love photo najlepiej	1	0	0	0	0	0	0	0	0	0	0	0	0	0	0	0	0
bust like 5 pair	0	0	0	0	0	0	0	0	1	0	0	0	0	0	0	0	0
drinking kale broccoli spinach barley grass juice juicing go drinking later hour	0	0	0	0	0	0	0	0	0	0	0	0	0	0	0	0	0
smile selfie smile	0	0	2	0	0	0	0	0	0	0	0	0	0	0	0	0	0
thankful clean water thankful positive	0	0	0	0	0	0	0	0	0	0	0	0	0	0	0	0	0
appleevent let relax little amp watch stormtroopers dancing amazing video	0	0	0	0	0	0	0	1	0	0	0	0	0	0	0	0	0
happiness chocolate ganache berriedalive cute food thatsdarling	0	0	0	0	0	0	0	0	0	0	1	0	0	0	0	0	0
buen provecho hello relax muscle gym boys guy guapos girls domingo model instagood ingers	0	0	0	0	0	0	0	0	0	0	0	0	0	0	0	0	0
navro z ayyomi barchamizga muborak bo lsin aktyor ulugbekkodirov uzb uzbek navruz	0	0	0	0	0	0	0	0	0	0	0	0	0	0	0	0	0
la belleza esta en el ojo del espectador sonrisa smile life feliz rulitos lentes amomipe	0	0	1	1	0	0	0	0	0	0	0	1	0	0	0	0	0
hulk kid kids nice beautiful usa barbie marvel	0	0	0	0	1	0	0	0	0	0	0	0	0	0	0	0	0
today happy love work friends shine bright	1	0	0	0	0	1	0	0	0	0	0	0	0	0	0	1	0
pega kid kids nice beautiful usa barbie marvel	0	0	0	0	1	0	0	0	0	0	0	0	0	0	0	0	0
happiness looks like flowers nature beauty amazing favorite love	1	0	0	0	0	0	0	0	1	0	0	0	0	0	0	0	0
alive mallorca spring colors	0	0	0	0	0	0	0	0	0	0	0	0	0	0	0	0	0
homemade cauliflower rocket soup side lowfat cottagecheese healthy lunch cheers	0	0	0	0	0	0	0	0	0	0	0	0	0	0	0	0	0
life comes around whatever makes	0	0	0	1	0	0	0	0	0	0	0	0	0	0	0	0	0
cabarete kitesurfing domrep cabarete caribbean sun beach	0	0	0	0	0	0	0	0	0	0	0	0	0	0	0	0	0
zamalek blanco radio live smile selfie	0	0	1	0	0	0	0	0	0	0	0	0	0	0	0	0	0
copines bonheur bonheurpermanent pigalle lepigalle internationdayofhappiness	0	0	0	0	0	0	0	0	0	0	0	0	0	0	0	0	0
mother day	0	1	0	0	0	0	0	0	0	0	0	0	0	0	0	0	0
moon uranai recipe	0	0	0	0	0	0	0	0	0	0	0	0	0	0	0	0	0
navro z ayyomi barchamizga muborak bo lsin aktyor adiz radjabov uzb uzbek navruz	0	0	0	0	0	0	0	0	0	0	0	0	0	0	0	0	0
maravillas de tener cerca una florera love monday flowers spring primavera fiori design	1	0	0	0	0	0	1	0	0	0	0	0	0	0	0	0	0
greentea lemon mineralwater slimming tea drinking	0	0	0	0	0	0	0	0	0	0	0	0	0	0	0	0	0
feeling blue monday fabpix gemmawebb model uk2usa wembley	0	0	0	0	0	0	0	0	0	0	0	0	0	0	0	0	0
lethal much fun beauty intelligence love health business	1	0	0	0	0	0	0	0	0	0	0	0	0	1	0	0	0
havent tweeted bit r u good	0	0	0	0	0	0	0	0	0	0	0	0	0	0	0	0	1
yo soy feliz como una lombris santiago	0	0	0	0	0	0	0	0	0	0	0	0	0	0	0	0	0
chocolate de brasil chocolet brasil chocolate ilovechocolate detalles	0	0	0	0	0	0	1	0	0	0	0	0	0	0	0	0	0
finally got apples apples honeycrisp bestdamnapplesever juicy crisp delicious howboutthemapples	0	0	0	0	0	0	0	0	0	0	0	0	0	0	0	0	0
un gusto delicioso mxico df churros elmoro churrera churreraelmoro rico delicioso moment	0	0	0	0	0	0	0	0	0	0	0	0	0	0	0	0	0
chocolate de brasil chocolet brasil chocolate ilovechocolate detalles	0	0	0	0	0	0	1	0	0	0	0	0	0	0	0	0	0
empezando utilizar twitter felizlunes amigos socute friendzone friends twitter lomasvisto	0	0	0	0	0	0	0	0	0	0	0	0	0	0	0	0	0
met flik got signature waltdisneyworld animalkingdom abugslife flik	0	0	0	0	0	0	0	0	0	0	0	0	0	0	0	0	0
train simple tips blog zaktiactive	0	0	0	0	0	0	0	0	0	0	0	0	0	0	0	0	0
mis babys kiser marley smile magic soar friends actrizcolombia vida juventud naturaleza paz pi	0	0	1	0	0	0	0	0	0	0	0	0	0	0	0	0	0
mi cumpleaera hermosa bdaygirl wife cabosanlucas sunny monday loscabos pueblobonitosunsetbeach	0	0	0	0	0	0	0	0	0	0	0	0	0	0	0	0	0
bosse beautiful photooftheday sweet instagood girl 2016 greeneyes felicidad moment mome	0	0	0	0	1	0	0	0	0	0	0	0	0	0	0	0	0
uno de los secretos para ser feliz es tener mala memoria smile	0	0	1	0	0	0	1	0	0	0	0	0	0	0	0	0	0
love job proud fine example set betterhealthatwork ambassadors	1	0	0	0	0	0	0	0	0	0	0	0	0	0	0	0	0
aprovechar las sonrisas genuinas photooftheday picoftheday smile happiness hair husband love lovely	1	0	1	0	0	0	0	0	0	0	0	0	0	0	0	0	0
ikealiebe liebe polagram polaroids homeinterior love home monday ikea	1	0	0	0	0	0	0	0	0	0	0	0	0	0	0	0	0
whitegold diamond 1karat design vijewelry spring handmade handmadejewelry unique	0	0	0	0	0	0	0	0	0	0	0	0	0	0	0	0	0
dye hair like lovingit newcolor pink want dyedhair crazyidea	0	0	0	0	0	0	0	0	1	0	0	0	0	0	0	0	0
absolutely beautiful show proud twait toseeitagain	0	0	0	0	1	0	0	0	0	0	0	0	0	0	0	0	0
tough happy monday instagood followforfollow smile instadaily foodie swag amazing fashion lo	0	0	1	0	0	1	0	0	0	0	0	0	0	0	0	0	0
live set simba rolling work good friend barry	0	0	0	0	0	0	0	0	0	0	0	0	0	0	0	0	1
diventare donna una cosa meravigliosa woman prontaperlestate followme nullaecasuale	0	0	0	0	0	0	0	0	0	0	0	0	0	0	0	0	0
fab day bringiton excited future smiles feelinggood ohyeah wicked newjob	0	1	0	0	0	0	0	0	0	0	0	0	0	0	0	0	0
aprovechar las sonrisas genuinas photooftheday picoftheday smile happiness hair husband love lovely	1	0	1	0	0	0	0	0	0	0	0	0	0	0	0	0	0
lunchtime almoo almuerzo oquis nhoque molho bolognesa ilikebrazil travelphoto saopaulo	0	0	0	0	0	0	0	0	0	0	0	0	0	0	0	0	0
navro z ayyomi barchamizga muborak bo lsin raqqosa shodiyora omonova uzb uzbek	0	0	0	0	0	0	0	0	0	0	0	0	0	0	0	0	0
good night world bestoftheday tbt istanbul nature aniyakala vsco vscocam	0	0	0	0	0	0	0	0	0	0	0	0	0	0	0	0	1
tempe kid kids nice beautiful usa barbie marvel	0	0	0	0	1	0	0	0	0	0	0	0	0	0	0	0	0
arroces begiak smile like4like monday lunes foodporn food good	0	0	1	0	0	0	0	0	0	0	0	0	0	0	0	0	1
mothers day mom	0	1	0	0	0	0	0	0	0	0	0	0	0	0	0	0	0
tb photooftheday instagood instapic spring topofthemorning sunrise	0	0	0	0	0	0	0	0	0	0	0	0	0	0	0	0	0
real fake honesty fake real beyourself live laugh fun	0	0	0	0	0	0	0	0	0	0	0	0	0	1	0	0	0
arroces begiak smile like4like monday lunes foodporn food good	0	0	1	0	0	0	0	0	0	0	0	0	0	0	0	0	1
food family tabasco	0	0	0	0	0	0	0	0	0	0	0	0	0	0	0	0	0
got like 10 new lashes lol	0	0	0	0	0	0	0	0	1	0	0	0	0	0	0	0	0
worldhappinessday today day get shake dance proven increase happiness dance toronto boogie	0	1	0	0	0	0	0	0	0	0	0	0	0	0	0	1	0
thank god apple finally introduced smaller phone big hands know iphonese	0	0	0	0	0	0	0	0	0	0	0	0	0	0	0	0	0
working potd ootd outfit workoutfit pink knitwaer crazyface selfie	0	0	0	0	0	0	0	0	0	0	0	0	0	0	0	0	0
baby koala baby photos endings animals cute funny orphaned baby koala	0	0	0	0	0	0	0	0	0	0	1	0	0	0	0	0	0
veggies pot roast sauce food foodie foodblogger foodporn omnomnom yummy q8 kuwait caroli	0	0	0	0	0	0	0	0	0	0	0	0	0	0	0	0	0
know love fall asleep reality finally better dreams dr seuss wedding love	2	0	0	0	0	0	0	0	0	0	0	0	0	0	0	0	0
dont girl fell girl got back jenette stanley love women	1	0	0	0	0	0	0	0	0	0	0	0	0	0	0	0	0
cul es el patito feo duckfamily	0	0	0	0	0	0	0	0	0	0	0	0	0	0	0	0	0
lo nuestro es tan grande tan especial q nada nos podr separar te necesito en mi vida amada soltera goodlife	0	0	0	0	0	0	0	0	0	0	0	0	0	0	0	0	0
mothers day pet kotob khan cats	0	1	0	0	0	0	0	0	0	0	0	0	0	0	0	0	0
1r72 904 girls hipster	0	0	0	0	0	0	0	0	0	0	0	0	0	0	0	0	0
introductiontoleanforserviceandmanufacturingorganizations twitter writing cinch	0	0	0	0	0	0	0	0	0	0	0	0	0	0	0	0	0
navro z ayyomi barchamizga muborak bo lsin xonanda munisarizaeva uzb uzbek navruz	0	0	0	0	0	0	0	0	0	0	0	0	0	0	0	0	0
lovetwitter 10years	0	0	0	0	0	0	0	0	0	0	0	0	0	0	0	0	0
worked 5 1 zumba 40 mins time shower eat	0	0	0	0	0	0	0	0	0	0	0	0	0	0	0	0	0
empieza la semana ponte tu mejor labial sonre que hoy es lunes lunes blog	0	0	0	0	0	0	0	0	0	0	0	1	1	0	0	0	0
cry smile happened dr suess gratitude attitude	0	0	1	0	0	0	0	0	0	0	0	0	0	0	0	0	0
never seen anyone fucked great big dick interracial porn nsfw	0	0	0	0	0	0	0	0	0	0	0	0	0	0	0	0	0
sister smile iloveyou	0	0	1	0	0	0	0	0	0	0	0	0	0	0	0	0	0
say thank nurses make things possible nurseappreciation nurseday thankyou makethemsmile	0	0	0	0	0	0	0	0	0	0	0	0	0	0	0	0	0
monday around golfisgreat monday thecrossingsatcarlsbad	0	0	0	0	0	0	0	0	0	0	0	0	0	0	0	0	0
pshhhhh team new friends friendly girl fun	0	0	0	0	0	0	0	0	0	0	0	0	0	1	0	0	0
navro z ayyomi barchamizga muborak bo lsin xonanda uzb uzbek navruz	0	0	0	0	0	0	0	0	0	0	0	0	0	0	0	0	0
scary new paranormal mystery amp detective medical thriller haunted within bookclubs cry	0	0	0	0	0	0	0	1	0	0	0	0	0	0	0	0	0
scary new paranormal mystery amp detective medical thriller haunted within bookclubs cry	0	0	0	0	0	0	0	1	0	0	0	0	0	0	0	0	0
customer ben rocking fg tand twinsspecial 12oz gloves fightersgear	0	0	0	0	0	0	0	0	0	0	0	0	0	0	0	0	0
rehearsal life inshot cute summer blur sun fun hair beach hot cool	0	0	0	1	0	0	0	0	0	0	1	0	0	1	0	0	0
android gets better every single year a11y mobile	0	0	0	0	0	0	0	0	0	0	0	0	0	0	0	0	0
cat keyifler yerinde motivation cat animal good	0	0	0	0	0	0	0	0	0	0	0	0	0	0	0	0	1
valencia sun smile laugh star necklace black eyes longhair instacool instalike	0	0	1	0	0	0	0	0	0	0	0	0	0	0	0	0	0
abaikan yang baju merah wkwk vscocam moment	0	0	0	0	0	0	0	0	0	0	0	0	0	0	0	0	0
never seen horse happier myboy love horselove equine beautiful	1	0	0	0	1	0	0	0	0	0	0	0	0	0	0	0	0
warlocks angels warriors 6th thriller conspiracy paranormal excited last freeebook	0	0	0	0	0	0	0	0	0	0	0	0	0	0	0	0	0
live girlfriend webcam fantasy webcammodel babe female pussy	0	0	0	0	0	0	0	0	0	0	0	0	0	0	0	0	0
jump jump jump phuket patong amazingthailand thailand fun freedombeach friends hollydays mkeey1	0	0	0	0	0	0	0	0	0	0	0	0	0	1	0	0	0
mar paz agua alone playa la punta	0	0	0	0	0	0	0	0	0	0	0	1	0	0	0	0	0
dinner 19thcenturyburger loveit ecgatchie 19th	0	0	0	0	0	0	0	0	0	0	0	0	0	0	0	0	0
bicycle icegirl newhobby	0	0	0	0	0	0	0	0	0	0	0	0	0	0	0	0	0
hom kid kids nice beautiful usa barbie marvel	0	0	0	0	1	0	0	0	0	0	0	0	0	0	0	0	0
personally women get make videos eyecandy fair right equality	0	0	0	0	0	0	0	0	0	0	0	0	0	0	0	0	0
wow wee super rainbow vodka great bottle good luck easter	0	0	0	0	0	0	0	0	0	0	0	0	0	0	0	0	1
adamlevine shesinlove	0	0	0	0	0	0	0	0	0	0	0	0	0	0	0	0	0
like freedom liking happiness qotd liveyourdreams freedom	0	0	0	0	0	0	0	0	1	0	0	0	0	0	0	0	0
keep customer list organized customers	0	0	0	0	0	0	0	0	0	0	0	0	0	0	0	0	0
monday weekdays quotes repost inspire inspiration today days bethy604	0	0	0	0	0	0	0	0	0	0	0	0	0	0	0	1	0
favorite easter candy chocolate bunny family jesus mytenznet	0	0	0	0	0	0	0	0	0	0	0	0	0	0	0	0	0
considering career pivot career one happiest around careerpivot careerchange	0	0	0	0	0	0	0	0	0	0	0	0	0	0	0	0	0
gift day special springlook tbt cute instagood orafrique followme photooftheday tagsforlikes	0	1	0	0	0	0	0	0	0	0	1	0	0	0	0	0	0
gift day special springlook tbt cute instagood orafrique followme photooftheday tagsforlikes	0	1	0	0	0	0	0	0	0	0	1	0	0	0	0	0	0
end matter	0	0	0	0	0	0	0	0	0	0	0	0	0	0	0	0	0
want 9 things stop right mentalhealth happiness selfesteem peace mhsm mhchat	0	0	0	0	0	0	0	0	0	0	0	0	0	0	0	0	0
pub favourites pub monday summervibes	0	0	0	0	0	0	0	0	0	0	0	0	0	0	0	0	0
primavera priscilla lluvioso da de crossfit baile salsa yoga love friends prisgor	1	0	0	0	0	0	1	0	0	0	0	0	0	0	0	0	0
navro z ayyomi barchamizga muborak bo lsin aktrisa shaxzoda muxammedova uzb uzbek	0	0	0	0	0	0	0	0	0	0	0	0	0	0	0	0	0
selfie hombredetrabajo music miusic musica guitarrista guitarra guitar acustic acustico	0	0	0	0	0	0	0	0	0	0	0	0	0	0	0	0	0
selfie hombredetrabajo music miusic musica guitarrista guitarra guitar acustic acustico	0	0	0	0	0	0	0	0	0	0	0	0	0	0	0	0	0
selfie hombredetrabajo music miusic musica guitarrista guitarra guitar acustic acustico	0	0	0	0	0	0	0	0	0	0	0	0	0	0	0	0	0
mientras grr8 se fue una reunin de trabajo yo te camino la nyc lovenyc new	0	0	0	0	0	0	1	0	0	0	0	1	0	0	0	0	0
person work twenty free happy mothers day brand786 brand786me mothersday	0	1	0	0	0	1	0	0	0	0	0	0	0	0	0	0	0
well made 100happydays entry today congrats amy promoting	0	0	0	0	0	0	0	0	0	0	0	0	0	0	0	1	0
	0	0	0	0	0	0	0	0	0	1	0	0	0	0	0	0	0
worry kaye menner photography quality prints cards	0	0	0	0	0	0	0	0	0	0	0	0	0	0	0	0	0
10 easy steps happier living health via	0	0	0	0	0	0	0	0	0	0	0	0	0	0	0	0	0
porfin que grandee pi loulogio lovehim bcn	0	0	0	0	0	0	0	0	0	0	0	0	1	0	0	0	0
fui recatada hace un ao ahora soy muy feliz felizlunes rescued year ago spring	0	0	0	0	0	0	0	0	0	0	0	0	0	0	0	0	0
little needed make life within way thinking marcus aurelius happy monday peeps x	0	0	0	1	0	1	0	0	0	0	0	0	0	0	0	0	0
os gusta el delicioso aroma de de clinique pues la fragancia missgiordani de oriflame os encantar	0	0	0	0	0	0	3	0	0	0	0	1	0	0	0	0	0
cutestuff etsy etsyseller stylish shopetsy fashion	0	0	0	0	0	0	0	0	0	0	0	0	0	0	0	0	0
j ai eu la chance et l honneur de avoir dans vie maman fte de maman mothers day	0	1	0	0	0	0	2	0	0	0	0	1	0	0	0	0	0
