wishing amp colorful holi holi holi2016 festival festivalofcolors rangbarse holihai	0	0	0	0	0	0	0	1	0	0	0	0	0	0	0	0	0
drop water mean worldwaterday sdgs goal6	0	0	0	0	0	0	0	0	0	0	0	0	0	0	0	0	0
happy smile thursday holidays free boy men smile sun amazing	0	0	2	0	0	1	0	0	0	0	0	0	0	0	0	0	0
love redhair hairstyle hair makeup eyes lips beautiful beauty cute amazing girl photooftheday	1	0	0	0	1	0	0	0	0	0	1	0	0	0	0	0	0
10k 46 minutes fitness gym proud timetogetfit motivated determined accomplished	0	0	0	0	0	0	0	0	0	0	0	0	0	0	0	0	0
wishing amp colorful holi holi holi2016 festival festivalofcolors rangbarse holihai	0	0	0	0	0	0	0	1	0	0	0	0	0	0	0	0	0
thanks suki	0	0	0	0	0	0	0	0	0	0	0	0	0	0	0	0	0
whatever decide make sure makes	0	0	0	0	0	0	0	0	0	0	0	0	0	0	0	0	0
leavingtomorrow aurevoir	0	0	0	0	0	0	0	0	0	0	0	0	0	0	0	0	0
good thing ever get enough music life loveit sing listen	0	0	0	1	0	0	0	0	0	0	0	0	0	0	0	0	1
good morning chicago love smile chicago downtown canal amp lake	1	0	1	0	0	0	0	1	0	0	0	0	0	0	0	0	1
shee olimulungi nyo bakuyiwako amata ne holy week	0	0	0	0	0	0	0	0	0	0	0	0	0	0	0	0	0
good coffee good magazines good vibes days	0	0	0	0	0	0	0	0	0	0	0	0	0	0	0	0	3
finalement twitter restera sur 140 caractres via	0	0	0	0	0	0	0	0	0	0	0	0	0	0	0	0	0
finalement twitter restera sur 140 caractres via	0	0	0	0	0	0	0	0	0	0	0	0	0	0	0	0	0
sea love friend thankyou spring	1	0	0	0	0	0	0	0	0	0	0	0	0	0	0	0	0
one orchids showing new shoot way makes	0	0	0	0	0	0	0	0	0	0	0	0	0	0	0	0	0
lovely lie bed lazy tuesday instagaydaily gayuk like4like	0	0	0	0	0	0	0	0	0	0	0	0	0	0	0	0	0
100 refollowjp picoftheday photooftheday	0	0	0	0	0	0	0	0	0	0	0	0	0	0	0	0	0
one favourite graphics tees season perfect spring spring ilovehopscotch ss16	0	0	0	0	0	0	0	0	0	0	0	0	0	0	0	0	0
cant think better representation beauty someone unafraid emma stone love women	1	0	0	0	0	0	0	0	0	0	0	0	0	0	0	0	0
oudheusden holland heusden winter holiday holidays smile riwiera family foto	0	0	1	0	0	0	0	0	0	0	0	0	0	0	0	0	0
please like blogger facebookpage facebook like facebookblogger life bloggerswanted compsoon	0	0	0	1	0	0	0	0	2	0	0	0	0	0	0	0	0
esperando subir al avin travel week salas de embarque nacional	0	0	0	0	0	0	1	0	0	0	0	0	0	0	0	0	0
cuddles kitty cat cute purring cuddles adorable gizmo video snugglykitty	0	0	0	0	0	0	0	0	0	0	1	0	0	0	0	0	0
would happiest take test find britian test	0	0	0	0	0	0	0	0	0	0	0	0	0	0	0	0	0
0322 magictowncafe cafe enjoy	0	0	0	0	0	0	0	0	0	0	0	0	0	0	0	0	0
simples assim bomdia goodmorning ame viva sorria sejafeliz feliz life love	1	0	0	1	0	0	0	0	0	0	0	0	0	0	0	0	0
picoftheday magician	0	0	0	0	0	0	0	0	0	0	0	0	0	0	0	0	0
nazi ebay items w swastika visit store bad love evil hate sad sex la ny us usa xmas aa	1	0	0	0	0	0	0	0	0	0	0	1	0	0	0	0	0
l estate sta arrivando correre ai ripari instafit fitness healt felice rinascita	0	0	0	0	0	0	0	0	0	0	0	0	0	0	0	0	0
smile smiling tags toptags smiles beautifulsmile smiley smilee pretty model model	0	0	1	0	0	0	0	0	0	0	0	0	0	0	0	0	0
cap kid kids nice beautiful usa barbie marvel	0	0	0	0	1	0	0	0	0	0	0	0	0	0	0	0	0
age nothing number healthy age	0	0	0	0	0	0	0	0	0	0	0	0	0	0	0	0	0
converse allstar new sneaker shoes gold instapic instagood	0	0	0	0	0	0	0	0	0	0	0	0	0	0	0	0	0
	0	0	0	0	0	0	0	0	0	1	0	0	0	0	0	0	0
really fun pay autowala via paytm khuchro headache digitalrevolution gooddays smallthings bigsolution	0	0	0	0	0	0	0	0	0	0	0	0	0	1	0	0	0
california follow homebaking foodpic	0	0	0	0	0	0	0	0	0	0	0	0	0	0	0	0	0
mais amor por favor bomdia perfeitoprahj omundoprecisadeamor ame sejafeliz belo	0	0	0	0	0	0	0	0	0	0	0	0	0	0	0	0	0
may god gift colors life colors joy colors happiness colors friendship holi	0	0	0	1	0	0	0	0	0	0	0	0	0	0	0	0	0
bom dia riodejaneiro life rj barradatijuca jesus 30tododia cool fun god hope	0	0	0	1	0	0	0	0	0	0	0	0	0	1	0	0	0
f f f g g f g life quote positive fear	0	0	0	1	0	0	0	0	0	0	0	0	0	0	0	0	0
printemps music	0	0	0	0	0	0	0	0	0	0	0	0	0	0	0	0	0
happy day beach beachstyle day friends sunnyday goodday thx im saaamia324	0	2	0	0	0	1	0	0	0	0	0	0	0	0	0	0	0
facce da cammelli zoo verona bussolengo zoosafari relax smile love	1	0	1	0	0	0	0	0	0	0	0	0	0	0	0	0	0
putting work love qluxspa lipolight loseweight waisttrain exercise healthy	1	0	0	0	0	0	0	0	0	0	0	0	0	0	0	0	0
life comes around whatever makes	0	0	0	1	0	0	0	0	0	0	0	0	0	0	0	0	0
	0	0	0	0	0	0	0	0	0	1	0	0	0	0	0	0	0
meigen	0	0	0	0	0	0	0	0	0	0	0	0	0	0	0	0	0
run free run runner life seaside free passion	0	0	0	1	0	0	0	0	0	0	0	0	0	0	0	0	0
myclass11a	0	0	0	0	0	0	0	0	0	0	0	0	0	0	0	0	0
jellycat goodnight nite nitenite teddybear dinosaur best bestfriends bbf tomorrowwillbegreat inst	0	0	0	0	0	0	0	0	0	0	0	0	0	0	0	0	0
lovely meal thank indianfood mayfair london benaresrestaurant goodfood	0	0	0	0	0	0	0	0	0	0	0	0	0	0	0	0	0
1 today day selfie good friend bff	0	1	0	0	0	0	0	0	0	0	0	0	0	0	0	1	1
11 secrets keep employees	0	0	0	0	0	0	0	0	0	0	0	0	0	0	0	0	0
latepost newfriends pic	0	0	0	0	0	0	0	0	0	0	0	0	0	0	0	0	0
free sex dating girls hd porno hot love cute beautiful girls teens	1	0	0	0	1	0	0	0	0	0	1	0	0	0	0	0	0
amp constantly give thanks everything making fruit salad work	0	0	0	0	0	0	0	1	0	0	0	0	0	0	0	0	0
hello project 2016	0	0	0	0	0	0	0	0	0	0	0	0	0	0	0	0	0
la	0	0	0	0	0	0	0	0	0	0	0	1	0	0	0	0	0
tiga toga graduation lefrancais apprendrelefranais frx unnes pbp2010 special	0	0	0	0	0	0	0	0	0	0	0	0	0	0	0	0	0
expat internations join free get social get gt	0	0	0	0	0	0	0	0	0	0	0	0	0	0	0	0	0
makeup dayoff	0	0	0	0	0	0	0	0	0	0	0	0	0	0	0	0	0
delivery ikea came today	0	0	0	0	0	0	0	0	0	0	0	0	0	0	0	1	0
7 tips get healthy	0	0	0	0	0	0	0	0	0	0	0	0	0	0	0	0	0
last single wonder trending miami	0	0	0	0	0	0	0	0	0	0	0	0	0	0	0	0	0
early 2 hours till full morning consultations takes place tired businessisgood	0	0	0	0	0	0	0	0	0	0	0	0	0	0	0	0	0
thankful another day another chance better dope amp focused smile goodmorning positiveforwardmovement	0	1	1	0	0	0	0	1	0	0	0	0	0	0	0	0	0
unidos pelo caf united coffee coffee instacool instacoffee instalove goodmorning	0	0	0	0	0	0	0	0	0	0	0	0	0	0	0	0	0
mi espalda es un buzn de correos que las cosas la cara smile fun instahappy sohappy happier	0	0	1	0	0	0	1	0	0	0	0	1	1	1	0	0	0
con mi nueva adquisicin de uo estudio muy fan de los unicornios latiendadeuo cute	0	0	0	0	0	0	2	0	0	0	1	0	0	0	0	0	0
slept dreamed life joy awoke amp found life duty j acted amp behold duty joy happiness thought	0	0	0	2	0	0	0	2	0	0	0	0	0	0	0	0	0
2nd day lenten season holytuesday holyweek san	0	1	0	0	0	0	0	0	0	0	0	0	0	0	0	0	0
happy make change stop change	0	0	0	0	0	1	0	0	0	0	0	0	0	0	0	0	0
koh rock fitness fit thailand espectacular travel clanfitsp	0	0	0	0	0	0	0	0	0	0	0	0	0	0	0	0	0
mom cancer survivor roadtrip pure magic	0	0	0	0	0	0	0	0	0	0	0	0	0	0	0	0	0
last single wonder trending miami	0	0	0	0	0	0	0	0	0	0	0	0	0	0	0	0	0
singapore amazing absolutely love city asia travel holiday sunshine	1	0	0	0	0	0	0	0	0	0	0	0	0	0	0	0	0
hom kid kids nice beautiful usa barbie marvel	0	0	0	0	1	0	0	0	0	0	0	0	0	0	0	0	0
oven baked eggplant recipe eggplant vegetable food yummy foodie delicious	0	0	0	0	0	0	0	0	0	0	0	0	0	0	0	0	0
bonak mutfagnn lezzeti avlu bonak mutfag ile hizmetinizde esiz damakk tad new haber	0	0	0	0	0	0	0	0	0	0	0	0	0	0	0	0	0
great tuesday	0	0	0	0	0	0	0	0	0	0	0	0	0	0	0	0	0
monk teapot set puer tea brewtea tue sg sin life love lifeinsin lifeinsg	1	0	0	1	0	0	0	0	0	0	0	0	0	0	0	0	0
watching makes think dad right running lord	0	0	0	0	0	0	0	0	0	0	0	0	0	0	0	0	0
thailand love sand strand snorkeling beautiful insel goodtimes holiday amazing addicted girl	1	0	0	0	1	0	0	0	0	0	0	0	0	0	0	0	0
contenta sunday day	0	1	0	0	0	0	0	0	0	0	0	0	0	0	0	0	0
new year hardly remeber last time celebrated nowruz family lol	0	0	0	0	0	0	0	0	0	0	0	0	0	0	0	0	0
nagoya chocolate love instagood l4l	1	0	0	0	0	0	0	0	0	0	0	0	0	0	0	0	0
instamood happiness good waterfall water waterfallsfordays instagram instagain	0	0	0	0	0	0	0	0	0	0	0	0	0	0	0	0	1
theeloshopy main yg ga bikin bosen cuma ini lego always love game	1	0	0	0	0	0	0	0	0	0	0	0	0	0	0	0	0
tuesday love one cutie love	2	0	0	0	0	0	0	0	0	0	0	0	0	0	0	0	0
flower sakura spring sun	0	0	0	0	0	0	0	0	0	0	0	0	0	0	0	0	0
yes please thank serena thankyou wish	0	0	0	0	0	0	0	0	0	0	0	0	0	0	0	0	0
love bunny filter snapchat bunny funny girl cute snapchat love sofun xoxo xx	2	0	0	0	0	0	0	0	0	0	1	0	0	0	0	0	0
holi aarush tripathi bjpinup bjp bjpsamwadup manojmishra beinggabbar	0	0	0	0	0	0	0	0	0	0	0	0	0	0	0	0	0
omfg happy right justbeginning keepgoing thankgod	0	0	0	0	0	1	0	0	0	0	0	0	0	0	0	0	0
spring visit website norwalk shopping	0	0	0	0	0	0	0	0	0	0	0	0	0	0	0	0	0
live girlfriend orgasm russia caucasian granny webcam female webcammodel	0	0	0	0	0	0	0	0	0	0	0	0	0	0	0	0	0
goodmorning goodpeople tuesday dosomethingdifferent thankmelater pleasantvisions	0	0	0	0	0	0	0	0	0	0	0	0	0	0	0	0	0
hoy toca ser feliz today	0	0	0	0	0	0	0	0	0	0	0	0	0	0	0	1	0
j comprei outfit pros meus anos	0	0	0	0	0	0	0	0	0	0	0	0	0	0	0	0	0
scores arrived cantwait mezzo summerfun music love tchaikovsky mascagni	1	0	0	0	0	0	0	0	0	0	0	0	0	0	0	0	0
lunchbreak coffee balcony sunshine spring life karlsruhe germany	0	0	0	1	0	0	0	0	0	0	0	0	0	0	0	0	0
tobehome tobehomeagain	0	0	0	0	0	0	0	0	0	0	0	0	0	0	0	0	0
motivation inspiration training love live livingthedream amazing igers	1	0	0	0	0	0	0	0	0	0	0	0	0	0	0	0	0
city lights paris france love students hitchhike effieltower itskatedarling eiffel tower fran	1	0	0	0	0	0	0	0	0	0	0	0	0	0	0	0	0
sunny tuesday sunnyday loveit travel roadtrip sunglasses coffeeaddict slovenia freedom sky	0	0	0	0	0	0	0	0	0	0	0	0	0	0	0	0	0
tittyuesday bdsmteam pic tied	0	0	0	0	0	0	0	0	0	0	0	0	0	0	0	0	0
puer tea brewtea tue sg sin life love lifeinsin lifeinsg	1	0	0	1	0	0	0	0	0	0	0	0	0	0	0	0	0
biz neden bu kadar elendik merveayseogur big lip eyes lipstick smile funny fun	0	0	1	0	0	0	0	0	0	0	0	0	0	1	0	0	0
techhippie inspiration amazing motivation success fashion life live fitness nofilter good loveit	0	0	0	1	0	0	0	0	0	0	0	0	0	0	0	0	1
two4tuesday something makes u today sure twice peace	0	0	0	0	0	0	0	0	0	0	0	0	0	0	0	1	0
two4tuesday something makes u today sure twice peace	0	0	0	0	0	0	0	0	0	0	0	0	0	0	0	1	0
sun shining lido londonfields digital meadow silk scarf	0	0	0	0	0	0	0	0	0	0	0	0	0	0	0	0	0
nevergiveup iloveyou	0	0	0	0	0	0	0	0	0	0	0	0	0	0	0	0	0
hkh 3 hkh	0	0	0	0	0	0	0	0	0	0	0	0	0	0	0	0	0
que sejam poucos mais que sejam de verdade friends pic tbt rio de janeiro brazil	0	0	0	0	0	0	2	0	0	0	0	0	2	0	0	0	0
goodmorning girlsaretheprettiest tuesday family ariajune	0	0	0	0	0	0	0	0	0	0	0	0	0	0	0	0	0
two morningsunshine beautifulday pineapple inlove smile today allisgood thatsdarling	0	0	1	0	0	0	0	0	0	0	0	0	0	0	0	1	0
broke happy	0	0	0	0	0	1	0	0	0	0	0	0	0	0	0	0	0
tuesday coffee	0	0	0	0	0	0	0	0	0	0	0	0	0	0	0	0	0
holi nepal segundo ao celebrando el holi fest con los	0	0	0	0	0	0	0	0	0	0	0	0	0	0	0	0	0
puppies gone new family puppy beautiful bluemerle blacktri redtri gorgeous litter	0	0	0	0	1	0	0	0	0	0	0	0	0	0	0	0	0
life mixture colors nature naturelovers canon eoslife zeiss love life pink white green	1	0	0	2	0	0	0	0	0	0	0	0	0	0	0	0	0
sample thursday crafting	0	0	0	0	0	0	0	0	0	0	0	0	0	0	0	0	0
projet dragon ball z ngative fini dbz anime manga draw fun ngative b amp w	0	0	0	0	0	0	0	1	0	0	0	0	0	1	0	0	0
us tell us celebrated stay	0	0	0	0	0	0	0	0	0	0	0	0	0	0	0	0	0
paseito con luna golden goldenretriever luna lovely picoftheday sea love	1	0	0	0	0	0	0	0	0	0	0	0	0	0	0	0	0
puer tea brewtea tue sg sin life love lifeinsin lifeinsg	1	0	0	1	0	0	0	0	0	0	0	0	0	0	0	0	0
nofilter beautifulday beautifulpeople sneak peek new collection african	0	0	0	0	0	0	0	0	0	0	0	0	0	0	0	0	0
nazi ebay items w swastika visit store bad love evil hate sad sex la ny us usa xmas aa	1	0	0	0	0	0	0	0	0	0	0	1	0	0	0	0	0
apanhei minha confidente com bum bum pro ar boy instaboy friend gay	0	0	0	0	0	0	0	0	0	0	0	0	0	0	0	0	0
today going beautiful choose peace joy passionforlife	0	0	0	0	1	0	0	0	0	0	0	0	0	0	0	1	0
share love follow like please favorite love motivational success quote quotes	2	0	0	0	0	0	0	0	1	0	0	0	0	0	0	0	0
happy forget hope youre h p p happy forget wish youre h p p	0	0	0	0	0	2	0	0	0	0	0	0	0	0	0	0	0
dahan dahan hanggang umabot tayo sa sukdulan ahhhhh sarap ng feeling amazed	0	0	0	0	0	0	0	0	0	0	0	0	0	0	0	0	0
control like good morning happy tuesday morning	0	0	0	0	0	1	0	0	1	0	0	0	0	0	0	0	1
happy tuesday spring air tuesday spring	0	0	0	0	0	1	0	0	0	0	0	0	0	0	0	0	0
unidos pelo caf united coffee coffee instacool instacoffee instalove goodmorning	0	0	0	0	0	0	0	0	0	0	0	0	0	0	0	0	0
mi espalda es un buzn de correos que las cosas la cara smile fun instahappy sohappy happier	0	0	1	0	0	0	1	0	0	0	0	1	1	1	0	0	0
hello tuesday makeup makeupaddict makeupjunkie basiclook	0	0	0	0	0	0	0	0	0	0	0	0	0	0	0	0	0
love friendship game instagood cutie follow followme photooftheday beautiful selfies like4lik	1	0	0	0	1	0	0	0	0	0	0	0	0	0	0	0	0
today new day glad rejoice amp productive hope tuesday	0	1	0	0	0	0	0	1	0	0	0	0	0	0	0	1	0
instag app love instagood photooftheday beautiful followme picoftheday fun	1	0	0	0	1	0	0	0	0	0	0	0	0	1	0	0	0
sky instagood tbt stars instadaily igers livefolk folkmagazine streetphotography	0	0	0	0	0	0	0	0	0	0	0	0	0	0	0	0	0
unidos pelo caf united coffee coffee instacool instacoffee instalove goodmorning	0	0	0	0	0	0	0	0	0	0	0	0	0	0	0	0	0
motivation inspiration positivevibes positivemind lifeisgood yoga yesican katysteinberg	0	0	0	0	0	0	0	0	0	0	0	0	0	0	0	0	0
passion healthy wealthy joytrain	0	0	0	0	0	0	0	0	0	0	0	0	0	0	0	0	0
prayforbrussels love brussels caen france	1	0	0	0	0	0	0	0	0	0	0	0	0	0	0	0	0
v fashion tbt instamood friends lapibella gioia likeforlikes polishboy instapic	0	0	0	0	0	0	0	0	0	0	0	0	0	0	0	0	0
hom kid kids nice beautiful usa barbie marvel	0	0	0	0	1	0	0	0	0	0	0	0	0	0	0	0	0
5 lego lego toys play	0	0	0	0	0	0	0	0	0	0	0	0	0	0	0	0	0
padrona felice gatto felice joy sweet springtime sun picoftheday	0	0	0	0	0	0	0	0	0	0	0	0	0	0	0	0	0
sommers progress shakes booster plan plans taking summer healthy summer	0	0	0	0	0	0	0	0	0	0	0	0	0	0	0	0	0
instagram geoloc lelac ski ucpatignes2016	0	0	0	0	0	0	0	0	0	0	0	0	0	0	0	0	0
nature perfect medicine altwaystoheal healthy healing	0	0	0	0	0	0	0	0	0	0	0	0	0	0	0	0	0
goodtimes instapic adorable stunnig daily instadaily university undergrad	0	0	0	0	0	0	0	0	0	0	0	0	0	0	0	0	0
happy always love peace life joy happiness kid children	1	0	0	1	0	1	0	0	0	0	0	0	0	0	0	0	0
added video playlist wealthy healthy show law pain day 1 learn bad	0	1	0	0	0	0	0	0	0	0	0	0	0	0	0	0	0
whatever decide make sure makes	0	0	0	0	0	0	0	0	0	0	0	0	0	0	0	0	0
wealthy healthy show law pain day 1 learn bad experiences via	0	1	0	0	0	0	0	0	0	0	0	0	0	0	0	0	0
holi	0	0	0	0	0	0	0	0	0	0	0	0	0	0	0	0	0
eu fao isso sempre inlove loving love loveyou morning kisses hugs	1	0	0	0	0	0	0	0	0	0	0	0	0	0	0	0	0
cat photo sunglasses usj smile s4s l4l instagood follow	0	0	1	0	0	0	0	0	0	0	0	0	0	0	0	0	0
happy spring springtime spring2016 healthy peace love laura mcdonald health	1	0	0	0	0	1	0	0	0	0	0	0	0	0	0	0	0
repost mariesipkova love black dark club prague awesome follow	1	0	0	0	0	0	0	0	0	0	0	0	0	0	0	0	0
inshot girls cut blur sun fun hair hot cool fashion friends smile	0	0	1	0	0	0	0	0	0	0	0	0	0	1	0	0	0
kid	0	0	0	0	0	0	0	0	0	0	0	0	0	0	0	0	0
tumbuhlah dengan indah dan jadilah penyejuk greenhouse flowers	0	0	0	0	0	0	0	0	0	0	0	0	0	0	0	0	0
responsible creating good life love happiness gratitude grateful	1	0	0	1	0	0	0	0	0	0	0	0	0	0	0	0	1
quotes happiness behappy smile grateful gratitude quotestoliveby love instaquotes inspire motivat	1	0	1	0	0	0	0	0	0	0	0	0	0	0	0	0	0
10 basic rules happier life may surprise contentment lieberson	0	0	0	1	0	0	0	0	0	0	0	0	0	0	0	0	0
selfie	0	0	0	0	0	0	0	0	0	0	0	0	0	0	0	0	0
thankful children thankful positive	0	0	0	0	0	0	0	0	0	0	0	0	0	0	0	0	0
time summer hat soon hat summerhat somadeinchelsea blackhat lovetwitter blondehair curls	0	0	0	0	0	0	0	0	0	0	0	0	0	0	0	0	0
lifeperfect smile	0	0	1	0	0	0	0	0	0	0	0	0	0	0	0	0	0
quotes happiness behappy smile grateful gratitude quotestoliveby love instaquotes inspire motivat	1	0	1	0	0	0	0	0	0	0	0	0	0	0	0	0	0
six scientists six suicides secret dying protect goodread booklovers bookclub	0	0	0	0	0	0	0	0	0	0	0	0	0	0	0	0	0
six scientists six suicides secret dying protect goodread booklovers bookclub	0	0	0	0	0	0	0	0	0	0	0	0	0	0	0	0	0
taiyangping thankyou	0	0	0	0	0	0	0	0	0	0	0	0	0	0	0	0	0
thankful able choose thankful positive	0	0	0	0	0	0	0	0	0	0	0	0	0	0	0	0	0
good day 0322 picnic duffy shelliemay yoyogi park	0	1	0	0	0	0	0	0	0	0	0	0	0	0	0	0	1
sheer determination means going dublin target weight muststaythin determined diet exercises weightloss	0	0	0	0	0	0	0	0	0	0	0	0	0	0	0	0	0
positive stay realistic positivethinking mentalwellbeing	0	0	0	0	0	0	0	0	0	0	0	0	0	0	0	0	0
	0	0	0	0	0	0	0	0	0	1	0	0	0	0	0	0	0
amazing follow4follow instapic webstagram shout 20like tagsforlike statigram followme love pe	1	0	0	0	0	0	0	0	0	0	0	0	0	0	0	0	0
disneysea disneysea tds happiness love bff	1	0	0	0	0	0	0	0	0	0	0	0	0	0	0	0	0
vote ahora por love followme beautiful girl picoftheday like smile bestoftheday	1	0	1	0	1	0	0	0	1	0	0	0	0	0	0	0	0
hand cream cute love packaging love beauty bblogger cream skincare	2	0	0	0	0	0	0	0	0	0	1	0	0	0	0	0	0
welcome spring friend celebration	0	0	0	0	0	0	0	0	0	0	0	0	0	0	0	0	0
thankful kindness strangers thankful positive	0	0	0	0	0	0	0	0	0	0	0	0	0	0	0	0	0
essa sou eu fotografar foto photographie photo imagem ideia love tempo time vida life	1	0	0	1	0	0	0	0	0	0	0	0	0	0	0	0	0
friends pool later smile funny photo beautiful bd	0	0	1	0	1	0	0	0	0	0	0	0	0	0	0	0	0
msgpureproducts top qwality product holly guru ji advance	0	0	0	0	0	0	0	0	0	0	0	0	0	0	0	0	0
feliz de la vida con metas por delante que cumplir jejeje instachile instasantiago santalucia feliz	0	0	0	0	0	0	1	0	0	0	0	1	1	0	0	0	0
wedding follow instanice igers iger canon husband editorial work woman wedding weddingday ph	0	0	0	0	0	0	0	0	0	0	0	0	0	0	0	0	0
make wolves happy even fluffy ones preybra whitebra spring	0	0	0	0	0	1	0	0	0	0	0	0	0	0	0	0	0
know thinking days	0	0	0	0	0	0	0	0	0	0	0	0	0	0	0	0	0
find happiness nature eclectic ave nature life	0	0	0	1	0	0	0	0	0	0	0	0	0	0	0	0	0
	0	0	0	0	0	0	0	0	0	1	0	0	0	0	0	0	0
presents snufkin aquamarin love like	1	0	0	0	0	0	0	0	1	0	0	0	0	0	0	0	0
sonrisa smile style ojos achinados like4like follow4follow aburrida noche calor horan tomlin	0	0	1	0	0	0	0	0	0	0	0	0	0	0	0	0	0
farkl marka model seenekleri sitemizde indirim millionaire markahobinet	0	0	0	0	0	0	0	0	0	0	0	0	0	0	0	0	0
porque en la vida nunca se sabe hay que vivir luchar hay que sentir disfrutar photooftheday	0	0	0	0	0	0	0	0	0	0	0	1	2	0	0	0	0
plans future larat poem	0	0	0	0	0	0	0	0	0	0	0	0	0	0	0	0	0
black today selfie day sun glasses fun love instagood instamood	1	1	0	0	0	0	0	0	0	0	0	0	0	1	0	1	0
great day inpired	0	1	0	0	0	0	0	0	0	0	0	0	0	0	0	0	0
tuunailin tss mun puhelimen alkunytt 3 phone metalhead nytonhyv jes	0	0	0	0	0	0	0	0	0	0	0	0	0	0	0	0	0
despicable 2 trivialcommute	0	0	0	0	0	0	0	0	0	0	0	0	0	0	0	0	0
frenchbulldog buhi grandma dog	0	0	0	0	0	0	0	0	0	0	0	0	0	0	0	0	0
pin kid kids nice beautiful usa barbie marvel	0	0	0	0	1	0	0	0	0	0	0	0	0	0	0	0	0
always finding new friend dog friend dogs friends smile adventures cute	0	0	1	0	0	0	0	0	0	0	1	0	0	0	0	0	0
thanku uarethebest profesionalphotographer natalie104 new photos	0	0	0	0	0	0	0	0	0	0	0	0	0	0	0	0	0
show affection towards kids boosts self confidence makes individuals parenting	0	0	0	0	0	0	0	0	0	0	0	0	0	0	0	0	0
love jessie friends friendship girls brunettes memories laughs	1	0	0	0	0	0	0	0	0	0	0	0	0	0	0	0	0
people plan actions plan results denis waitley	0	0	0	0	0	0	0	0	0	0	0	0	0	0	1	0	0
caught watching proposal tears	0	0	0	0	0	0	0	0	0	0	0	0	0	0	0	0	0
good morning day	0	1	0	0	0	0	0	0	0	0	0	0	0	0	0	0	1
happy	0	0	0	0	0	1	0	0	0	0	0	0	0	0	0	0	0
beautiful clarity simplicity selfmade livelovelaugh humble peace blessed imagine	0	0	0	0	1	0	0	0	0	0	0	0	0	0	0	0	0
buendiaparatodos tuesday22 somos tu yo contra todo	0	0	0	0	0	0	0	0	0	0	0	0	0	0	0	0	0
thank hope good day tallgoddess busty gorgeous	0	1	0	0	0	0	0	0	0	0	0	0	0	0	0	0	1
happy people choose via	0	0	0	0	0	1	0	0	0	0	0	0	0	0	1	0	0
red hijab kids kiddos love day boys boy baby sleep bxchange mall	1	1	0	0	0	0	0	0	0	0	0	0	0	0	0	0	0
happiness fact 8 friend increases probability happy 9 bncd 2010	0	0	0	0	0	1	0	0	0	0	0	0	0	0	0	0	0
g morning tuesday make awesome day	0	1	0	0	0	0	0	0	0	0	0	0	0	0	0	0	0
stop looking reasons unhappy think reasons instead	0	0	0	0	0	0	0	0	0	0	0	0	0	0	0	0	0
teen girl teens teenager tags4likes like4like followme awesome girls student smile beautiful	0	0	1	0	1	0	0	0	0	0	0	0	0	0	0	0	0
nice game play adventure game alto journey great timepass gaming	0	0	0	0	0	0	0	0	0	0	0	0	0	0	0	0	0
farkl marka model seenekleri sitemizde indirim millionaire markahobinet	0	0	0	0	0	0	0	0	0	0	0	0	0	0	0	0	0
	0	0	0	0	0	0	0	0	0	1	0	0	0	0	0	0	0
lepotaizdravljesrbija rainyday apple gold flatlay whiteonwhite magazine luxury	0	0	0	0	0	0	0	0	0	0	0	0	0	0	0	0	0
wann heute streamerino sotrue nur 4 stunden morgen letzter schultag	0	0	0	0	0	0	0	0	0	0	0	0	0	0	0	0	0
positive day say thank u god 4 giving another day practice mindfulness journal stretch let light wish some1 gr8 day	0	3	0	0	0	0	0	0	0	0	0	0	0	0	0	0	0
de sal de cu de mar eu sou goodmorning beach sun daybeautiful blessed	0	0	0	0	0	0	3	0	0	0	0	0	0	0	0	0	0
mean whatever whathappend lovecat cimut rain	0	0	0	0	0	0	0	0	0	0	0	0	0	0	0	0	0
science tell us happiness generated life psychology	0	0	0	1	0	0	0	0	0	0	0	0	0	0	0	0	0
nazi ebay items w swastika visit store bad love evil hate sad sex la ny us usa xmas aa	1	0	0	0	0	0	0	0	0	0	0	1	0	0	0	0	0
hope fantastic day yet happy happy happy tuesday smiles	0	1	0	0	0	3	0	0	0	0	0	0	0	0	0	0	0
beat box music madeinfrance	0	0	0	0	0	0	0	0	0	0	0	0	0	0	0	0	0
beat box music madeinfrance	0	0	0	0	0	0	0	0	0	0	0	0	0	0	0	0	0
beat box music madeinfrance	0	0	0	0	0	0	0	0	0	0	0	0	0	0	0	0	0
boys	0	0	0	0	0	0	0	0	0	0	0	0	0	0	0	0	0
buy listen music video royalty stock audiojungle walk fun smile	0	0	1	0	0	0	0	0	0	0	0	0	0	1	0	0	0
sweet easter baby kgnome grl etsy treasury unique handmade easter basket via	0	0	0	0	0	0	0	0	0	0	0	0	0	0	0	0	0
gimana ya cara ambilnya perhatikan video ini yeayy alia bisa thaliaputrionsu	0	0	0	0	0	0	0	0	0	0	0	0	0	0	0	0	0
bijna 2weken oud en nog zo mooi superblij	0	0	0	0	0	0	0	0	0	0	0	0	0	0	0	0	0
tuesday blessingsloveandlightuntousall make day life great	0	1	0	1	0	0	0	0	0	0	0	0	0	0	0	0	0
plus interactif plus clair plus convivial le nouveau site web rideau arrive bientt nouveau	0	0	0	0	0	0	0	0	0	0	0	0	0	0	0	0	0
milano di corsa e riuscire dare un bacio al volo mia sorella ad un incrocio	0	0	0	0	0	0	0	0	0	0	0	0	0	0	0	0	0
goodmorning openday cloudysky rain workingday tirelessly villa luz campamentos	0	0	0	0	0	0	0	0	0	0	0	0	0	0	0	0	0
sonrisa smile style ojos achinados like4like follow4follow aburrida noche calor horan tomlin	0	0	1	0	0	0	0	0	0	0	0	0	0	0	0	0	0
porque en la vida nunca se sabe hay que vivir luchar hay que sentir disfrutar photooftheday	0	0	0	0	0	0	0	0	0	0	0	1	2	0	0	0	0
amanecer en los anapurnas rincondeltibet anapurnas amanecer pepelanau pokhara nepal	0	0	0	0	0	0	0	0	0	0	0	0	0	0	0	0	0
girls prettiest audreyhepburn pretty beautiful wearing quotes quo	0	0	0	0	1	0	0	0	0	0	0	0	0	0	0	0	0
ya han llegado mis labiales eye liner de nyx que ganas tengo de probarlos emocion emocionada feliz	0	0	0	0	0	0	2	0	0	0	0	0	1	0	0	0	0
le soupir une jolie fille entend plus loin que le rugissement un lion pretty fashionblogger cute	0	0	0	0	0	0	0	0	0	0	1	0	1	0	0	0	0
view love relax sun sea sand summer spring lifestyle foreveronvacation holiday italy travel	1	0	0	0	0	0	0	0	0	0	0	0	0	0	0	0	0
	0	0	0	0	0	0	0	0	0	1	0	0	0	0	0	0	0
protect eyes play safe holi holi team asg	0	0	0	0	0	0	0	0	0	0	0	0	0	0	0	0	0
iced vanilla soy latte x mmmmm xx love life beautiful picoftheday lovelovelove	1	0	0	1	1	0	0	0	0	0	0	0	0	0	0	0	0
sonrisa smile style ojos achinados like4like follow4follow aburrida noche calor horan tomlin	0	0	1	0	0	0	0	0	0	0	0	0	0	0	0	0	0
porque en la vida nunca se sabe hay que vivir luchar hay que sentir disfrutar photooftheday	0	0	0	0	0	0	0	0	0	0	0	1	2	0	0	0	0
feliz de la vida con metas por delante que cumplir jejeje instachile instasantiago santalucia feliz	0	0	0	0	0	0	1	0	0	0	0	1	1	0	0	0	0
wedding follow instanice igers iger canon husband editorial work woman wedding weddingday ph	0	0	0	0	0	0	0	0	0	0	0	0	0	0	0	0	0
summer smile gooddays newphoto photography satj	0	0	1	0	0	0	0	0	0	0	0	0	0	0	0	0	0
natural positive affirmation	0	0	0	0	0	0	0	0	0	0	0	0	0	0	0	0	0
happy always love peace life joy happiness kid children	1	0	0	1	0	1	0	0	0	0	0	0	0	0	0	0	0
20160321 korea seoul hongdae shopping	0	0	0	0	0	0	0	0	0	0	0	0	0	0	0	0	0
treats feet socks newarrivals shoponline	0	0	0	0	0	0	0	0	0	0	0	0	0	0	0	0	0
no1 0322 chihana odaibabeach date firsttime love	1	0	0	0	0	0	0	0	0	0	0	0	0	0	0	0	0
valued positive affirmation	0	0	0	0	0	0	0	0	0	0	0	0	0	0	0	0	0
safe positive affirmation	0	0	0	0	0	0	0	0	0	0	0	0	0	0	0	0	0
ultimando detallitos de mi nuevo blog de literatura queemocion literatura cineytv music lavanda	0	0	0	0	0	0	2	0	0	0	0	0	0	0	0	0	0
10 scientific ways please retweet	0	0	0	0	0	0	0	0	0	0	0	0	0	0	0	0	0
gymcrush healthy fitness workout fitnessaddict work gym training motivation	0	0	0	0	0	0	0	0	0	0	0	0	0	0	0	0	0
holy nepal	0	0	0	0	0	0	0	0	0	0	0	0	0	0	0	0	0
	0	0	0	0	0	0	0	0	0	1	0	0	0	0	0	0	0
	0	0	0	0	0	0	0	0	0	1	0	0	0	0	0	0	0
russiangirl russianboys russia gm girl saintp	0	0	0	0	0	0	0	0	0	0	0	0	0	0	0	0	0
happy tuesday today going amazing day allow positive tuesday	0	1	0	0	0	1	0	0	0	0	0	0	0	0	0	1	0
laugh friend blog funeral fun funny laugh family youth grief sorrow sister mom dad	0	0	0	0	0	0	0	0	0	0	0	0	0	1	0	0	0
lol v tenangakuhanyabecanda memeindonesia memeinajah memeindo dagelan lol	0	0	0	0	0	0	0	0	0	0	0	0	0	0	0	0	0
great new car delivered	0	0	0	0	0	0	0	0	0	0	0	0	0	0	0	0	0
temple monks river wedesignlife	0	0	0	0	0	0	0	0	0	0	0	0	0	0	0	0	0
happy tuliptuesday everyone flowerstation flowers spring flowerdelivery londonflorists tulips	0	0	0	0	0	1	0	0	0	0	0	0	0	0	0	0	0
hey love vscocam likes4likes like goodday love gofollow	2	0	0	0	0	0	0	0	1	0	0	0	0	0	0	0	0
	0	0	0	0	0	0	0	0	0	1	0	0	0	0	0	0	0
