relax fun park loveit sisters	0	0	0	0	0	0	0	0	0	0	0	0	0	1	0	0	0
travel genie itinerary love fun f4f sun beach woohoo awesome giveaway thank amazing chance	1	0	0	0	0	0	0	0	0	0	0	0	0	1	0	0	0
love couple couplegoals couples cute girlfriend boyfriend like4like inlove relationshipgoals love	2	0	0	0	0	0	0	0	0	0	1	0	0	0	0	0	0
need learn nature seldom chance circumstance lavetta sue wegman	0	0	0	0	0	0	0	0	0	0	0	0	0	0	0	0	0
weekend weekend twodaysholiday	0	0	0	0	0	0	0	0	0	0	0	0	0	0	0	0	0
rocks gig squad nightout gig besties pout	0	0	0	0	0	0	0	0	0	0	0	0	0	0	0	0	0
lawofattraction healing loa healthy well	0	0	0	0	0	0	0	0	0	0	0	0	0	0	0	0	0
casita empiezan mis mini vacaciones minivacaciones feliz holidays	0	0	0	0	0	0	0	0	0	0	0	0	0	0	0	0	0
margaret looking view latergram love nyc view restaurant amp lounge	1	0	0	0	0	0	0	1	0	0	0	0	0	0	0	0	0
holi	0	0	0	0	0	0	0	0	0	0	0	0	0	0	0	0	0
gorgeous day	0	1	0	0	0	0	0	0	0	0	0	0	0	0	0	0	0
poet happiness appreciation appreciate love loveothers peace positivevibes positivity compassion choosehappy	1	0	0	0	0	0	0	0	0	0	0	0	0	0	0	0	0
le ped youtube que dedicara una feliz cancin aqu estoy cantando alegremente pharrellwilliams	0	0	0	0	0	0	0	0	0	0	0	0	1	0	0	0	0
amazing customer service 2 5yr old case broke amp replaced 10 year guarantee travel service promise	0	0	0	0	0	0	0	1	0	0	0	0	0	0	0	0	0
player game fun motivation inspiration gvo positivevibes positivemind nlp karysteinberg yesican	0	0	0	0	0	0	0	0	0	0	0	0	0	1	0	0	0
holi frndzzz enjoy holi	0	0	0	0	0	0	0	0	0	0	0	0	0	0	0	0	0
feeling great 3m tempo run lunch run sweating	0	0	0	0	0	0	0	0	0	0	0	0	0	0	0	0	0
meanwhile non cricketing post sunday selfie funday weekend friends sun love smile picofth	1	0	1	0	0	0	0	0	0	0	0	0	0	0	0	0	0
smile felicidad completa siento bendecida	0	0	1	0	0	0	0	0	0	0	0	0	0	0	0	0	0
nazi ebay items w swastika visit store bad love evil hate sad sex la ny us usa xmas aa	1	0	0	0	0	0	0	0	0	0	0	1	0	0	0	0	0
skilled positive affirmation	0	0	0	0	0	0	0	0	0	0	0	0	0	0	0	0	0
kings house	0	0	0	0	0	0	0	0	0	0	0	0	0	0	0	0	0
holi celebrating holi cyss office south campus	0	0	0	0	0	0	0	0	0	0	0	0	0	0	0	0	0
doce chocolate candy gordices delicious	0	0	0	0	0	0	0	0	0	0	0	0	0	0	0	0	0
relaxation amp positive mindset kids pre order new happy cards	0	0	0	0	0	1	0	1	0	0	0	0	0	0	0	0	0
smile felicidad live love peace muak	1	0	1	0	0	0	0	0	0	0	0	0	0	0	0	0	0
outside woods girl nude naked sweet small smile sexy pussy sh	0	0	1	0	0	0	0	0	0	0	0	0	0	0	0	0	0
yikes serious chris fashion magician illusionist like4like liverpool palm	0	0	0	0	0	0	0	0	0	0	0	0	0	0	0	0	0
one beat one love fanfics make feel alone time	1	0	0	0	0	0	0	0	0	0	0	0	0	0	0	0	0
coffee bae instagood instasize coffee starbucks snapchat bae venti love work	1	0	0	0	0	0	0	0	0	0	0	0	0	0	0	0	0
good night everyone holi	0	0	0	0	0	0	0	0	0	0	0	0	0	0	0	0	1
holi love lots blesses festivalofcolour	1	0	0	0	0	0	0	0	0	0	0	0	0	0	0	0	0
may feel urge get dance see via dance music	0	0	0	0	0	0	0	0	0	0	0	0	0	0	0	0	0
ani mejlumyan yerevan state university yerevan armenia day romani70 2 b twin	0	1	0	0	0	0	0	0	0	0	0	0	0	0	0	0	0
love life luckyman beautifulwife	1	0	0	1	0	0	0	0	0	0	0	0	0	0	0	0	0
ates lvcc caloocan asoptaping duty fif sif nofilter thankful tbtg	0	0	0	0	0	0	0	0	0	0	0	0	0	0	0	0	0
thankful cars thankful positive	0	0	0	0	0	0	0	0	0	0	0	0	0	0	0	0	0
thankful cars thankful positive	0	0	0	0	0	0	0	0	0	0	0	0	0	0	0	0	0
sister love holi crazy	1	0	0	0	0	0	0	0	0	0	0	0	0	0	0	0	0
optimism thoughts staypositive positivity positivevibes thinksouthpaw	0	0	0	0	0	0	0	0	0	0	0	0	0	0	0	0	0
use power mind heal body altwaystoheal healthy peace	0	0	0	0	0	0	0	0	0	0	0	0	0	0	0	0	0
wakeup live mindfully consciously forever depression	0	0	0	0	0	0	0	0	0	0	0	0	0	0	0	0	0
wow car deodorizer thingy really really stink great thoughts	0	0	0	0	0	0	0	0	0	0	0	0	0	0	0	0	0
itsgoodto watch top ten happiest endings film history films onlylove	0	0	0	0	0	0	0	0	0	0	0	0	0	0	0	0	0
lookie got rocknroll newmusic merch bandswag love onrepeat	1	0	0	0	0	0	0	0	0	0	0	0	0	0	0	0	0
hi hello goodmood selfhaircut haircut haarschnitt warntig weilspitzenamarsch	0	0	0	0	0	0	0	0	0	0	0	0	0	0	0	0	0
cesarmotors semanasanta cool love instagood vacaciones toyota landcruiser	1	0	0	0	0	0	0	0	0	0	0	0	0	0	0	0	0
today awesomely good day nice kinda days exciting plans ahead smile soexcited	0	1	1	0	0	0	0	0	0	0	0	0	0	0	0	1	1
share love follow like please favorite love motivational success quote quotes	2	0	0	0	0	0	0	0	1	0	0	0	0	0	0	0	0
smile mutluluk 2 1	0	0	1	0	0	0	0	0	0	0	0	0	0	0	0	0	0
book reading holidays thriller psicoanalista perfecttime tuesday descanso like	0	0	0	0	0	0	0	0	1	0	0	0	0	0	0	0	0
today esperando music felice mochila l4l like4like likeforlike	0	0	0	0	0	0	0	0	0	0	0	0	0	0	0	1	0
rambo rudy cat bengals bengalcat beautiful love cute family father son	1	0	0	0	1	0	0	0	0	0	1	0	0	0	0	0	0
smile fun instahappy sohappy happier excited feelinggood instatags4likes goodmood smiling funtime	0	0	1	0	0	0	0	0	0	0	0	0	0	1	0	0	0
saintp murmansk ticket newlife sosnovyy	0	0	0	0	0	0	0	0	0	0	0	0	0	0	0	0	0
lilly selfie selfienation selfies friend happiness swag love	1	0	0	0	0	0	0	0	0	0	0	0	0	0	0	0	0
cheers genuine people committed loving others every day	0	1	0	0	0	0	0	0	0	0	0	0	0	0	1	0	0
fitfam fitspo fitness fitlife motivation inspiration instafit instagood	0	0	0	0	0	0	0	0	0	0	0	0	0	0	0	0	0
meu grude irmo ph17	0	0	0	0	0	0	0	0	0	0	0	0	0	0	0	0	0
window door one day customer glass covered	0	1	0	0	0	0	0	0	0	0	0	0	0	0	0	0	0
alhamdulilah allah jannah	0	0	0	0	0	0	0	0	0	0	0	0	0	0	0	0	0
tuesday women business science technology meetup group 135 gogetters	0	0	0	0	0	0	0	0	0	0	0	0	0	0	0	0	0
seeing reddit site traffic 2705 visits right launchtime	0	0	0	0	0	0	0	0	0	0	0	0	0	0	0	0	0
minnie mouse tattoo finished love minniemouse love	2	0	0	0	0	0	0	0	0	0	0	0	0	0	0	0	0
resolutionday 23march	0	0	0	0	0	0	0	0	0	0	0	0	0	0	0	0	0
tuno je videti glumca kako vodi kviz sa starletom tv	0	0	0	0	0	0	0	0	0	0	0	0	0	0	0	0	0
ordered another wedding outfit	0	0	0	0	0	0	0	0	0	0	0	0	0	0	0	0	0
pursuit happiness lol career life success love yoga meditation hr recruiter buddhism	1	0	0	1	0	0	0	0	0	0	0	0	0	0	0	0	0
una maana de clases feliz boy instaboy chile friends	0	0	0	0	0	0	1	0	0	0	0	0	0	0	0	0	0
house listening happy every time silly good	0	0	0	0	0	1	0	0	0	0	0	0	0	0	0	0	1
stunning positive affirmation	0	0	0	0	0	0	0	0	0	0	0	0	0	0	0	0	0
stunning positive affirmation	0	0	0	0	0	0	0	0	0	0	0	0	0	0	0	0	0
instagram instalike instafollow sunglasses amazing follow followher follows	0	0	0	0	0	0	0	0	0	0	0	0	0	0	0	0	0
pretty day today	0	1	0	0	0	0	0	0	0	0	0	0	0	0	0	1	0
quotes inspiration inspirational behappy lovelife loveyourself love motivational	1	0	0	0	0	0	0	0	0	0	0	0	0	0	0	0	0
quotes inspiration inspirational behappy lovelife loveyourself love motivational	1	0	0	0	0	0	0	0	0	0	0	0	0	0	0	0	0
holli 2016	0	0	0	0	0	0	0	0	0	0	0	0	0	0	0	0	0
de visita en playa del carmen con el pequeo ricardo herbalife emavacation	0	0	0	0	0	0	1	0	0	0	0	0	0	0	0	0	0
	0	0	0	0	0	0	0	0	0	1	0	0	0	0	0	0	0
time perfectcupofcoffee simplethings downtime	0	0	0	0	0	0	0	0	0	0	0	0	0	0	0	0	0
hi look videomusic africans music musica pop hi hello show followme nice good yes ciao	0	0	0	0	0	0	0	0	0	0	0	0	0	0	0	0	1
thankyou kind words love hearing customers	1	0	0	0	0	0	0	0	0	0	0	0	0	0	0	0	0
last holi fb leave social groups holi holi guyzz enjoyfull	0	0	0	0	0	0	0	0	0	0	0	0	0	0	0	0	0
blessed incontrol	0	0	0	0	0	0	0	0	0	0	0	0	0	0	0	0	0
best friends forever friends playa	0	0	0	0	0	0	0	0	0	0	0	0	0	0	0	0	0
renewed annual subscription	0	0	0	0	0	0	0	0	0	0	0	0	0	0	0	0	0
fairytailzombie natsu lucy gt w lt	0	0	0	0	0	0	0	0	0	0	0	0	0	0	0	0	0
hermes finally boss	0	0	0	0	0	0	0	0	0	0	0	0	0	0	0	0	0
author ebook marketing 60pa celebrate photooftheday instagood candle candles young	0	0	0	0	0	0	0	0	0	0	0	0	0	0	0	0	0
pies para que los quiero si tengo alas para volar	0	0	0	0	0	0	0	0	0	0	0	0	1	0	0	0	0
dancing teddy bear logo intro animation interested purchasing please contact	0	0	0	0	0	0	0	0	0	0	0	0	0	0	0	0	0
read news anymore bringing kids horrible world said every generation ever going read stuff	0	0	0	0	0	0	0	0	0	0	0	0	0	0	0	0	0
nouveau tlphone	0	0	0	0	0	0	0	0	0	0	0	0	0	0	0	0	0
john brings car back college pops tire right dad bought four new ones love siblinggoals	1	0	0	0	0	0	0	0	0	0	0	0	0	0	0	0	0
25miles bike ride workout cardio fitness ilovefitness fitnessaddict tuesday	0	0	0	0	0	0	0	0	0	0	0	0	0	0	0	0	0
ice cream go take trip makes happy buy card adventure icecream	0	0	0	0	0	1	0	0	0	0	0	0	0	0	0	0	0
old enough 2 b mother prob care b c crush taylor musicianship gets thru bad days	0	0	0	0	0	0	0	0	0	0	0	0	0	0	0	0	0
te amo quieroplaya marido teamo	0	0	0	0	0	0	0	0	0	0	0	0	0	0	0	0	0
holi holihai indian festival colour	0	0	0	0	0	0	0	0	0	0	0	0	0	0	0	0	0
always princess life actress gillestoucas	0	0	0	1	0	0	0	0	0	0	0	0	0	0	0	0	0
happy happy reason believe ability free agency make choice	0	0	0	0	0	2	0	0	0	0	0	0	0	0	0	0	0
little laughter soul jokes smile	0	0	1	0	0	0	0	0	0	0	0	0	0	0	0	0	0
time official twitter sallama sara salama	0	0	0	0	0	0	0	0	0	0	0	0	0	0	0	0	0
treats boss work amazing myfavs	0	0	0	0	0	0	0	0	0	0	0	0	0	0	0	0	0
changed better facts truth confidenceisup gotmytwig	0	0	0	0	0	0	0	0	0	0	0	0	0	0	0	0	0
nomnomnom mum made chicken yesterdag lot eat chicken days chickentuesday	0	0	0	0	0	0	0	0	0	0	0	0	0	0	0	0	0
woman makeup live paris france	0	0	0	0	0	0	0	0	0	0	0	0	0	0	0	0	0
flw lifestyle koreandramas flw bruxelles	0	0	0	0	0	0	0	0	0	0	0	0	0	0	0	0	0
everyone make smile everyone make happy mohamadbbaban smile	0	0	2	0	0	1	0	0	0	0	0	0	0	0	0	0	0
purim onza onzabar nightlife fun funny event apester picflip purim2016	0	0	0	0	0	0	0	0	0	0	0	0	0	1	0	0	0
monday trip beach goodnight goodafternoon bt alicante spain	0	0	0	0	0	0	0	0	0	0	0	0	0	0	0	0	0
hom kid kids nice beautiful usa barbie marvel	0	0	0	0	1	0	0	0	0	0	0	0	0	0	0	0	0
love find pics pic home happiness love lovely like ilikeit girl cutegir	2	0	0	0	0	0	0	0	1	0	0	0	0	0	0	0	0
pretty excited knockedup baby mumtobe pregnant love thatsdarling	1	0	0	0	0	0	0	0	0	0	0	0	0	0	0	0	0
alwayssmiling sunsetsurf hawaiisurf surfeveryday	0	0	0	0	0	0	0	0	0	0	0	0	0	0	0	0	0
trow edson edson instamen athome concepcin chile	0	0	0	0	0	0	0	0	0	0	0	0	0	0	0	0	0
kill smile dogslove sweet maybe thoughts niceweekend ink	0	0	1	0	0	0	0	0	0	0	0	0	0	0	0	0	0
con pindaaaa ti si te agarre cario po amp nos conocimos al ultimo pinda ultimodia fea edfis	0	0	0	0	0	0	0	1	0	0	0	0	0	0	0	0	0
friend sister brother juntos siempre love hello life like instamoment instapic instasize instas	1	0	0	1	0	0	0	0	1	0	0	0	0	0	0	0	0
lo malo es q el tiempo vuela lo bueno es q tu eres el piloto 3 poeta love	1	0	0	0	0	0	0	0	0	0	0	0	0	0	0	0	0
sun selfie smile fashion sweet homeboy nomercy winter hardwork money swag fidele finishboy fam	0	0	1	0	0	0	0	0	0	0	0	0	0	0	0	0	0
boatarde love like goodafternon maisumdia gracasadeus amor gratidao tranquility peace alterna	1	0	0	0	0	0	0	0	1	0	0	0	0	0	0	0	0
girls makeup cute follow followme photooftheday beautiful selfie picoftheday	0	0	0	0	1	0	0	0	0	0	1	0	0	0	0	0	0
day shadows lt 3	0	1	0	0	0	0	0	0	0	0	0	0	0	0	0	0	0
todos saben que sam se rasca cuando deja de mandar tweets nomeayudestanto mygirl comeon	0	0	0	0	0	0	1	0	0	0	0	0	1	0	0	0	0
boutta buy pringles	0	0	0	0	0	0	0	0	0	0	0	0	0	0	0	0	0
tongueouttuesday faveday frenchbulldog dogsofinstagram	0	0	0	0	0	0	0	0	0	0	0	0	0	0	0	0	0
let first day today waisttraining lipolight exercise nutrition healthy beautiful	0	1	0	0	1	0	0	0	0	0	0	0	0	0	0	1	0
sonya7r caleboquendo instagood zeiss35mm follow photooftheday followme beautiful	0	0	0	0	1	0	0	0	0	0	0	0	0	0	0	0	0
retweet win travel prizes genie plans itinerary 4u love fun f4f sun beach	1	0	0	0	0	0	0	0	0	0	0	0	0	1	0	0	0
outside freezing death spring	0	0	0	0	0	0	0	0	0	0	0	0	0	0	0	0	0
healthy means ready salad foodie veggie	0	0	0	0	0	0	0	0	0	0	0	0	0	0	0	0	0
inshot girl cute summer fun cool smile nofilter amazing style love	1	0	1	0	0	0	0	0	0	0	1	0	0	1	0	0	0
waiting train men man beard selfie driving sunglasses tuesdayselfie	0	0	0	0	0	0	0	0	0	0	0	0	0	0	0	0	0
sunny hawaii instrumental music hawaii sunny nowplaying steelguitar dobro country smile	0	0	1	0	0	0	0	0	0	0	0	0	0	0	0	0	0
positive music inspire optimistic videomarketing country nowplaying videohive gamedev	0	0	0	0	0	0	0	0	0	0	0	0	0	0	0	0	0
meus amores love instamood instalike photo girls selfie beautiful instagood	1	0	0	0	1	0	0	0	0	0	0	0	0	0	0	0	0
ever thought know choose usually helps overall outlook life	0	0	0	1	0	0	0	0	0	0	0	0	0	0	0	0	0
diseo del logotipo para creafy diseo fresco identity marca creative diseografico diseo	0	0	0	0	0	0	0	0	0	0	0	0	0	0	0	0	0
meigen	0	0	0	0	0	0	0	0	0	0	0	0	0	0	0	0	0
ottawa good work visits show thursday special guests	0	0	0	0	0	0	0	0	0	0	0	0	0	0	0	0	1
top adult date girls hd images hot love cute beautiful girls teens	1	0	0	0	1	0	0	0	0	0	1	0	0	0	0	0	0
look	0	0	0	0	0	0	0	0	0	0	0	0	0	0	0	0	0
dating nude sexy girls hot love cute beautiful girls teens	1	0	0	0	1	0	0	0	0	0	1	0	0	0	0	0	0
friend sister brother juntos siempre love hello life like instamoment instapic instasize instas	1	0	0	1	0	0	0	0	1	0	0	0	0	0	0	0	0
happy love fun smile redhead freckles	1	0	1	0	0	1	0	0	0	0	0	0	0	1	0	0	0
brilliance baffles thank taytetuesday tasteoftayte model	0	0	0	0	0	0	0	0	0	0	0	0	0	0	0	0	0
inspirational recovery mentalhealth positive inspiration happiness positivity depression depressed	0	0	0	0	0	0	0	0	0	0	0	0	0	0	0	0	0
hi new book book lahabitacin room emmadonoghue	0	0	0	0	0	0	0	0	0	0	0	0	0	0	0	0	0
jeudi je vais au bloc	0	0	0	0	0	0	0	0	0	0	0	0	0	0	0	0	0
5 first order free delivery spend 30 sexy adult	0	0	0	0	0	0	0	0	0	0	0	0	0	0	0	0	0
riodejaneiro sun christo beach fabian kk	0	0	0	0	0	0	0	0	0	0	0	0	0	0	0	0	0
worldwaterday everyone please think twice spring pouring gallons water ur grass amp consider painting yyc	0	0	0	0	0	0	0	1	0	0	0	0	0	0	0	0	0
wishing family bright colourful joyful holi love best wishes holi	1	0	0	0	0	0	0	0	0	0	0	0	0	0	0	0	0
wanted zaxby today got zaxby today really need restaurant much closer side town reside full	0	0	0	0	0	0	0	0	0	0	0	0	0	0	0	2	0
come try delicious matcha green tea latte float staxcookiebar uci icecream love	1	0	0	0	0	0	0	0	0	0	0	0	0	0	0	0	0
groes dankeschn das presseteam harz dankeschn news	0	0	0	0	0	0	0	0	0	0	0	0	0	0	0	0	0
shut dance mybaby cute beauty instayeahh followme like cool	0	0	0	0	0	0	0	0	1	0	1	0	0	0	0	0	0
shoulders muscles burn fitness popeye days	0	0	0	0	0	0	0	0	0	0	0	0	0	0	0	0	0
find love focus everyday focused energy goals	1	0	0	0	0	0	0	0	0	0	0	0	0	0	0	0	0
well never gets boring seeing book spiralize winning oneyou spiralizer	0	0	0	0	0	0	0	0	0	0	0	0	0	0	0	0	0
last hour lunch come join us harlem hour 4pm nyc	0	0	0	0	0	0	0	0	0	0	0	0	0	0	0	0	0
paris love goodone explore wanderlust eiffeltower world fernweh family	1	0	0	0	0	0	0	0	0	0	0	0	0	0	0	0	0
happiness state activity aristotle mindfulness life	0	0	0	1	0	0	0	0	0	0	0	0	0	0	0	0	0
happiness state activity aristotle mindfulness life	0	0	0	1	0	0	0	0	0	0	0	0	0	0	0	0	0
happiness state activity aristotle mindfulness life	0	0	0	1	0	0	0	0	0	0	0	0	0	0	0	0	0
happiness state activity aristotle mindfulness life	0	0	0	1	0	0	0	0	0	0	0	0	0	0	0	0	0
bright colours winter give way sweet smellingwhites belas chamelis ratranis chandani cjampa holi	0	0	0	0	0	0	0	0	0	0	0	0	0	0	0	0	0
end day gotta	0	1	0	0	0	0	0	0	0	0	0	0	0	0	0	0	0
picoftheday photooftheday smile instagirl fitness fitfam fitgirl good nice goodday summer se	0	0	1	0	0	0	0	0	0	0	0	0	0	0	0	0	1
	0	0	0	0	0	0	0	0	0	1	0	0	0	0	0	0	0
best bro bro work hard fun study university life istanbul bestoftheday photo	0	0	0	1	0	0	0	0	0	0	0	0	0	1	0	0	0
love life love family travel salzburg son st gilgen lake	2	0	0	1	0	0	0	0	0	0	0	0	0	0	0	0	0
never happier keeps gettin better transformationtuesday transisbeautiful	0	0	0	0	0	0	0	0	0	0	0	0	0	0	0	0	0
gbrl3 lithuania girl pilot beauty black white beautiful spikes crazy pilotlife love aviation	1	0	0	0	1	0	0	0	0	0	0	0	0	0	0	0	0
baby got first brand new car excited	0	0	0	0	0	0	0	0	0	0	0	0	0	0	0	0	0
story happiness work	0	0	0	0	0	0	0	0	0	0	0	0	0	0	0	0	0
colour best time day migato shoelove migatoshoes	0	1	0	0	0	0	0	0	0	0	0	0	0	0	0	0	0
ellas son hermosass tagsforlikes followme beauty	0	0	0	0	0	0	0	0	0	0	0	0	0	0	0	0	0
sunshine reflection light play itsallsunshine boss bitch	0	0	0	0	0	0	0	0	0	0	0	0	0	0	0	0	0
cancun viaje vacaciones sunday	0	0	0	0	0	0	0	0	0	0	0	0	0	0	0	0	0
make smile girl smile piercings piercedgirl longhair smoothhair bigsmile	0	0	2	0	0	0	0	0	0	0	0	0	0	0	0	0	0
invigorating walk sun today achieved 14k steps fitbit healthy fitfam beactive	0	0	0	0	0	0	0	0	0	0	0	0	0	0	0	1	0
pc elegant blond dress comely	0	0	0	0	0	0	0	0	0	0	0	0	0	0	0	0	0
ladies please body god gave	0	0	0	0	0	0	0	0	0	0	0	0	0	0	0	0	0
ya hacia falta un poco de sol sunnyday salamanca semanasanta vacations travel spain	0	0	0	0	0	0	1	0	0	0	0	0	0	0	0	0	0
voice echo armenian summer sunday kuwait model instagram	0	0	0	0	0	0	0	0	0	0	0	0	0	0	0	0	0
makes happy cuz end day happy living myway passion life getit	0	1	0	1	0	2	0	0	0	0	0	0	0	0	0	0	0
stack playlist rangoli dance holi	0	0	0	0	0	0	0	0	0	0	0	0	0	0	0	0	0
good old days oldpics	0	0	0	0	0	0	0	0	0	0	0	0	0	0	0	0	1
smiles	0	0	0	0	0	0	0	0	0	0	0	0	0	0	0	0	0
holi	0	0	0	0	0	0	0	0	0	0	0	0	0	0	0	0	0
bondage bdsm hardcore	0	0	0	0	0	0	0	0	0	0	0	0	0	0	0	0	0
work work work work study hard bestoftheday photo istanbul uskudar university	0	0	0	0	0	0	0	0	0	0	0	0	0	0	0	0	0
boatarde love like goodafternon maisumdia gracasadeus amor gratidao tranquility peace alterna	1	0	0	0	0	0	0	0	1	0	0	0	0	0	0	0	0
feliz follow4follow siguemeytesigo labios lab pintalabios kendalljenner k kar kloset kyli	0	0	0	0	0	0	0	0	0	0	0	0	0	0	0	0	0
gt wow juanita estas hermosa con tu chaco nosotrosfelices dogs mimadas familiachaco amore amor	0	0	0	0	0	0	0	0	0	0	0	0	0	0	0	0	0
music video royalty free electronic music purchase license soundcloud np	0	0	0	0	0	0	0	0	0	0	0	0	0	0	0	0	0
boatarde love like goodafternon maisumdia gracasadeus amor gratidao tranquility peace alterna	1	0	0	0	0	0	0	0	1	0	0	0	0	0	0	0	0
love l4l instagood daily tflers	1	0	0	0	0	0	0	0	0	0	0	0	0	0	0	0	0
though unconfirmatable mentally prepared give lift veg vendor woman got happy auto gave lift	0	0	0	0	0	1	0	0	0	0	0	0	0	0	0	0	0
te amo quieroplaya marido teamo	0	0	0	0	0	0	0	0	0	0	0	0	0	0	0	0	0
thumbs four daily habits make happier smile success	0	0	1	0	0	0	0	0	0	0	0	0	0	0	0	0	0
time notice power poseiden let live years save water worldwaterday	0	0	0	0	0	0	0	0	0	0	0	0	0	0	0	0	0
goodafternoon tuesday style cute sweet amazing awesome cool fun adorable	0	0	0	0	0	0	0	0	0	0	1	0	0	1	0	0	0
baby love selfie family familytime love baby babyboy sleep	2	0	0	0	0	0	0	0	0	0	0	0	0	0	0	0	0
evening run time take care recharge fuel spirit runningtime metime	0	0	0	0	0	0	0	0	0	0	0	0	0	0	0	0	0
charity spinnathon zoeplace babyhospital coventry health goodtimes fitness jellylegs	0	0	0	0	0	0	0	0	0	0	0	0	0	0	0	0	0
best bestie cute friend girls hapiness goodday likes smile selfie today	0	0	1	0	0	0	0	0	0	0	1	0	0	0	0	1	0
guru dev jai ho dine dine navam navam balihaar sanware holi	0	0	0	0	0	0	0	0	0	0	0	0	0	0	0	0	0
coleeee una de hoy aguante 5to 3ra ed fisica colegio lapiloto edfisica quinto	0	0	0	0	0	0	1	0	0	0	0	0	0	0	0	0	0
goodafternoon tuesday style cute sweet amazing awesome cool fun adorable	0	0	0	0	0	0	0	0	0	0	1	0	0	1	0	0	0
new booking page consulting website reach amp amp problemsolve reach goals lt 3	0	0	0	0	0	0	0	2	0	0	0	0	0	0	0	0	0
love seeing clearcorrect smile thanks sharing drpalm	1	0	1	0	0	0	0	0	0	0	0	0	0	0	0	0	0
hope find	0	0	0	0	0	0	0	0	0	0	0	0	0	0	0	0	0
todo puede pasar losangeles medlife ht	0	0	0	0	0	0	0	0	0	0	0	0	0	0	0	0	0
holi diii full injoy nd mastiii yr holii nd dad u 2 best wishes priya di	0	0	0	0	0	0	0	0	0	0	0	0	0	0	0	0	0
fyromeo yunsungday luce altis edit	0	0	0	0	0	0	0	0	0	0	0	0	0	0	0	0	0
get enough remix jes utb175 np loveit trancefamily	0	0	0	0	0	0	0	0	0	0	0	0	0	0	0	0	0
casadav sunset sunandlove family sun breath inspiration motivation positivelife happiness	0	0	0	0	0	0	0	0	0	0	0	0	0	0	0	0	0
care takes im stay	0	0	0	0	0	0	0	0	0	0	0	0	0	0	0	0	0
honorable positive affirmation	0	0	0	0	0	0	0	0	0	0	0	0	0	0	0	0	0
today good day new van arrived today amazing mercedesbenz	0	1	0	0	0	0	0	0	0	0	0	0	0	0	0	2	1
ca est le mien est arriv aujourd hui hungergames et vous	0	0	0	0	0	0	0	0	0	0	0	0	0	0	0	0	0
hornyhappens girlfriend gf bf love couple adorable romance together funny girl xoxo beautiful fu	1	0	0	0	1	0	0	0	0	0	0	0	0	0	0	0	0
girls cute blur fun hair hot cool fashion smile amazing style love	1	0	1	0	0	0	0	0	0	0	1	0	0	1	0	0	0
nawroz kurdish people	0	0	0	0	0	0	0	0	0	0	0	0	0	0	1	0	0
vsco vscocam vscorussia spring selfie	0	0	0	0	0	0	0	0	0	0	0	0	0	0	0	0	0
weather since seen sun shining clouds sunshine	0	0	0	0	0	0	0	0	0	0	0	0	0	0	0	0	0
mum gave tea concoctions weekend sijui lemon grass insomnia rumour	0	0	0	0	0	0	0	0	0	0	0	0	0	0	0	0	0
hey everyone happy tuesday tuesday	0	0	0	0	0	1	0	0	0	0	0	0	0	0	0	0	0
boys	0	0	0	0	0	0	0	0	0	0	0	0	0	0	0	0	0
nephew cantik angiekalesaran friends family cute sweet nice smile kiss love	1	0	1	0	0	0	0	0	0	0	1	0	0	0	0	0	0
made favourite place sunset cyprus	0	0	0	0	0	0	0	0	0	0	0	0	0	0	0	0	0
mood girl flowers spring like love home julisirenko	1	0	0	0	0	0	0	0	1	0	0	0	0	0	0	0	0
30th first dates caandonga euphoria lovephoria nm	0	0	0	0	0	0	0	0	0	0	0	0	0	0	0	0	0
long end result ima call winning	0	0	0	0	0	0	0	0	0	0	0	0	0	0	0	0	0
beach time singledad daddylovesyou beach manzanillo colima	0	0	0	0	0	0	0	0	0	0	0	0	0	0	0	0	0
blue moon moon	0	0	0	0	0	0	0	0	0	0	0	0	0	0	0	0	0
miss already schmitt 14 family love kc kansascity travel 3generations dr	1	0	0	0	0	0	0	0	0	0	0	0	0	0	0	0	0
psychedelic slug coloredpencil paper love bright rainbow slug decor wall pop	1	0	0	0	0	0	0	0	0	0	0	0	0	0	0	0	0
istanbulkeyfi huzur photooftheday buralardayizsimdilik	0	0	0	0	0	0	0	0	0	0	0	0	0	0	0	0	0
saw home	0	0	0	0	0	0	0	0	0	0	0	0	0	0	0	0	0
holi friends	0	0	0	0	0	0	0	0	0	0	0	0	0	0	0	0	0
clarins	0	0	0	0	0	0	0	0	0	0	0	0	0	0	0	0	0
selfie swag smile l4l likes likeforfollow follow followme vsco	0	0	1	0	0	0	0	0	0	0	0	0	0	0	0	0	0
pin kid kids nice beautiful usa barbie marvel	0	0	0	0	1	0	0	0	0	0	0	0	0	0	0	0	0
happy spring team crosslinks spring crosslinks	0	0	0	0	0	1	0	0	0	0	0	0	0	0	0	0	0
kids campers	0	0	0	0	0	0	0	0	0	0	0	0	0	0	0	0	0
cafesitotime maana	0	0	0	0	0	0	0	0	0	0	0	0	0	0	0	0	0
sonrer siempre quotes carlamissfit carlamissfit	0	0	0	0	0	0	0	0	0	0	0	0	0	0	0	0	0
happy valley tv brazenly feminist show opening scene second season ha	0	0	0	0	0	1	0	0	0	0	0	0	0	0	0	0	0
blue point rolls one cleveland finest happy hour deals photos blue point grille raises happ	0	0	0	0	0	1	0	0	0	0	0	0	0	0	0	0	0
review happy valley season 2 follows tough first act incredibly well column discusses th	0	0	0	0	0	1	0	0	0	0	0	0	0	0	0	0	0
jobs roundup jobs water resources happy world water day happy world water day know tha	0	2	0	0	0	2	0	0	0	0	0	0	0	0	0	0	0
smile best way get away trouble even fake one photography sayings journey	0	0	1	0	0	0	0	0	0	0	0	0	0	0	0	0	0
conjunto xa claudia hecho mano por su ta	0	0	0	0	0	0	0	0	0	0	0	0	0	0	0	0	0
higher purpose fuel provide purpose career success alive entrepreneur	0	0	0	0	0	0	0	0	0	0	0	0	0	0	0	0	0
das instamoments picoftheday goodtime kiss	0	0	0	0	0	0	0	0	0	0	0	0	0	0	0	0	0
cool tweet blog elinchrom ltd elinchrom	0	0	0	0	0	0	0	0	0	0	0	0	0	0	0	0	0
thankful pets thankful positive	0	0	0	0	0	0	0	0	0	0	0	0	0	0	0	0	0
smile smiling top tags toptags smiles beautifulsmile smiley smilee pretty friend	0	0	1	0	0	0	0	0	0	0	0	0	0	0	0	0	0
sweet home lavieenrose sweethome pinkpower pink flowers flores instaflores home love loveit	1	0	0	0	0	0	0	0	0	0	0	0	0	0	0	0	0
solte segure boatarde happiness felicidade	0	0	0	0	0	0	0	0	0	0	0	0	0	0	0	0	0
moment put phone belly son kicks	0	0	0	0	0	0	0	0	0	0	0	0	0	0	0	0	0
prng brk brain florida springbreak tattooed ink tattooedlife fit fashion love photogra	1	0	0	0	0	0	0	0	0	0	0	0	0	0	0	0	0
sun selfie smile fashion sweet homeboy nomercy winter hardwork money swag fidele finishboy fam	0	0	1	0	0	0	0	0	0	0	0	0	0	0	0	0	0
light candle use flame savageswim	0	0	0	0	0	0	0	0	0	0	0	0	0	0	0	0	0
el besho de hoy amor pico	0	0	0	0	0	0	1	0	0	0	0	0	0	0	0	0	0
donuts morning two girls enjoying every moment family love	1	0	0	0	0	0	0	0	0	0	0	0	0	0	0	0	0
never late whoever want time limit enjoy life men women beyou	0	0	0	1	0	0	0	0	0	0	0	0	0	0	0	0	0
pues aqu bailando el guajolote encantaaaa guajolote bailedelguajolote dance	0	0	0	0	0	0	0	0	0	0	0	0	0	0	0	0	0
sweet home lavieenrose sweethome pinkpower pink flowers flores instaflores home love loveit	1	0	0	0	0	0	0	0	0	0	0	0	0	0	0	0	0
everything happens reason yesterday understood	0	0	0	0	0	0	0	0	0	0	0	0	0	0	0	0	0
smile kpop kdrama kfans oppa woobin kimwoobin worldwide modelo	0	0	1	0	0	0	0	0	0	0	0	0	0	0	0	0	0
ekleyin instag app love instagood photooftheday tbt cute beautiful	1	0	0	0	1	0	0	0	0	0	1	0	0	0	0	0	0
embroidery create	0	0	0	0	0	0	0	0	0	0	0	0	0	0	0	0	0
hi name sushi kitten cat blackandwhite whiskers sweet cute soft love	1	0	0	0	0	0	0	0	0	0	1	0	0	0	0	0	0
love work marketing pr strategy anythingispossible brands fashion celeb life	1	0	0	1	0	0	0	0	0	0	0	0	0	0	0	0	0
por esto uno tiene que trabajar en semana santa ll3 foxlife junta mdyssl	0	0	0	0	0	0	0	0	0	0	0	0	1	0	0	0	0
sweet home lavieenrose sweethome pinkpower pink flowers flores instaflores home love loveit	1	0	0	0	0	0	0	0	0	0	0	0	0	0	0	0	0
feel happier wellbeing	0	0	0	0	0	0	0	0	0	0	0	0	0	0	0	0	0
say goodread goodbook page turning fast paced think tom peter	0	0	0	0	0	0	0	0	0	0	0	0	0	0	0	0	0
say goodread goodbook page turning fast paced think tom peter	0	0	0	0	0	0	0	0	0	0	0	0	0	0	0	0	0
15	0	0	0	0	0	0	0	0	0	0	0	0	0	0	0	0	0
cupcakes weakness love amazing food friends louisiana goodtimes	1	0	0	0	0	0	0	0	0	0	0	0	0	0	0	0	0
sit wonder wander find local wander positive	0	0	0	0	0	0	0	0	0	0	0	0	0	0	0	0	0
thank crowdfundx follow	0	0	0	0	0	0	0	0	0	0	0	0	0	0	0	0	0
raw jordan nike nikeair airjordan cement4 sneakerhead	0	0	0	0	0	0	0	0	0	0	0	0	0	0	0	0	0
life journey whatever passion passion	0	0	0	1	0	0	0	0	0	0	0	0	0	0	0	0	0
